Artist,Artist_id,Song,Song_id,LyricsEminem,7dGJo4pcD2V6oG8kP0tJRR,Fall,58QhkbaAkLFnn7JwAnAato, You know everybody s been tellin me what they think about me for the last few months It s too loud Maybe it s time I tell em what I think about them Ca nt hear it coming down the hallway stairs from the parking lot It s too loud Freeze my crown all up in it Slow fire Do nt fall on my face Do nt fall on my faith oh Do nt fall on my fate Do nt fall on my faith oh Do nt fall on my fate Do nt fall on my Got ta concentrate against the clock I race Got no time to waste I m already late I got a marathoner s pace Went from addict to a workaholic word to Dr Dre in that first marijuana tape Guess I got a chronic case And I ai nt just blowin smoke less it s in your mama s face I know this time Paul and Dre they wo nt tell me what not to say And though me and my party days have all pretty much parted ways You d swear to God I ve forgot I m the guy that made Not Afraid One last time for Charlemagne If my response is late it s just how long it takes To hit my fuckin radar I m so far away These rappers are like Hunger Games One minute they re mocking Jay Next minute they get they style from Migos then they copy Drake Maybe I just do nt know when to turn around and walk away But all the hate I call it Walk on Water gate I ve had as much as I can tolerate I m sick and tired of waitin I done lost my patience I can take all of you motherfuckers on at once You want it Shady You got it Do nt fall on my face Yeah Do nt fall on my faith oh Do nt fall on my fate Light him up Do nt fall on my faith oh Rrr Do nt fall on my fate Look Somebody tell Budden before I snap he better fasten it Or have his body baggage zipped The closest thing he s had to hits is smacking bitches And do nt make me have to give it back to Akademiks Say this shit is trash again I ll have you twisted like you had it when you thought you had me slippin at the telly Even when I m gettin brain you ll never catch me with a thot Lacking with it he ai nt spit like this in his last shit Hoe you better go back and listen You know me better thinkin I ll slow up let up Call it traps cause it s a total setup Hopin that you rappers fall in that Dre said Hold your head up Kathy Griffin stackin ammunition slap the clip and cock it back on competition this is how I shot a head pew Gabby Giffords my attack is viscous jack the ripper back in business Tyler create nothing I see why you called yourself a faggot bitch It s not just cause you lack attention It s cause you worship D12 s balls you re sacrilegious If you re gon na critique me you better at least be as good or better Get Earl the Hooded Sweater whatever his name is to help you put together some words more than two letters The fans waited for this moment Like the feature when I stole this show Sorry if I took forever Do nt fall on my face Yeah Do nt fall on my faith oh I wont Do nt fall on my fate Light him up Do nt fall on my faith oh Do nt fall on my fate It s too easy Just rememberI was here before you And I ll be here after you make your runin for you Detract this I might have to fuck Pitchfork with a corkscrew Just what the doctor ordered Revenge is the best medicine Increase the dose unleash the monster Then tell the Grammys to go and fuck themselves they suck the blood from all the biggest artists like some leeches So they nominate em get em there get a name to em See the show every parasite needs a host Then give Album of the Year to somebody that no one s ever even heard of All I know is I wrote every single word of everything I ever murdered Time to separate the sheep from goats And I got no faith in your writers I do nt believe in ghosts When rap needed it most I was that wing in the prayer A beacon of hope the BIRD in the air Somewhere some kid is bumping this while he lipsyncs in the mirror That s who I m doin it for the rest I do nt really even care But you would think I m carryin a Oxford dictionary in my pocket how I m buryin these artists On the scale it turns to minus Mines is various as hardly and what s scary is you prolly can compare me to your car cause I m barely gettin started And as far as Lord Jamar you better leave me the hell alone Or I ll show you an Elvis clone Walk up in this house you own Brush my pelvic bone You should tell a phone and go fetch me the remote Put my feet up and just make myself at home I belong here clown Do nt tell me bout the culture I inspire the Hopsins the Logics the Coles the Seans the KDots the 59 s and oh Brought the world 50 Cent you did squat pissed and moaned but I m not gon na fall bitch It s too loud Ca nt hear it coming down the hallway stairs from the parking lot It s too loud Freeze my crown all up in it Slow fire
Eminem,7dGJo4pcD2V6oG8kP0tJRR,River (feat. Ed Sheeran),1cS0TgbR263ey9jn0MwD2s, I ve been a liar been a thief Been a lover been a cheat All my sins need holy water Feel it washing over me Oh little one I do nt want to admit to something If all it s gon na cause is pain Truth in my lies right now are falling like the rain So let the river run He s coming home with his neck scratched to catch flack Sweat jackets and dress slacks mismatch On his breath s Jack is a sex addict And she just wants to exact revenge and get back It s a chess match she s on his back like a jet pack She s kept track of all his Internet chats And guess who just happens to be moving on to the next Actually just shit on my last chick and she has what my ex lacks Cause she loves danger psychopath And you do nt fuck with no man s girl even I know that But she s devised some plan To stab him in the back knife in hand Says the relationship s hanging by a strand So she s been on the web lately Says maybe she ll be my Gwen Stacy despite her man And I know she s using me to try to play him I do nt care hi Susanne but I shoulda said Bye Susanne After the first night but tonight I am I ve been a liar been a thief Been a lover been a cheat All my sins need holy water Feel it washing over me Oh little one I do nt want to admit to something If all it s gon na cause is pain Truth in my lies now are falling like the rain So let the river run Onenight stand turned into night staying He was calling so might scram now we hug tight and He found out now she feels deserted and used Cause he left so what He did it first to her too Now how am I supposed to tell this girl that we re through It s hard to find the words I m aloof nervous ensued And witnessed you hurt but what you deserve is the truth Do nt take it personal I just ca nt say this in person to you So I revert to the studio like hole in the wall diners Do nt have to be reserved in a booth I just feel like the person who I m turning intos Irreversible I preyed on you like it s church at the pew And now that I got you I do nt want you Took advantage of my thirst to pursue Why do I do this dirt that I do Get on my soapbox and preach my sermon and speech Detergent and bleach is burning the wound Cause now with her in the womb We ca nt bring her in this world shoulda knew To use protection fore I bit into your forbidden fruit Fuck I ve been a liar been a thief Been a lover been a cheat All my sins need holy water Feel it washing over me Oh little one I do nt want to admit to something If all it s gon na cause is pain Truth in my lies now are falling like the rain So let the river run My name s oh my name s oh Denver oh river run Call me oh call me oh River oh we ll let the river run Always the bridesmaid never the bride hey Fuck can I say If life was a highway The seat was an enclave I d be swerving in five lanes Speeds at a high rate like I m sliding on ice maybe That s why I may have came at you sideways I ca nt keep my lies straight What I made you terminate my baby This love triangle left us in a wreck tangled What else can I say It was fun for a while Bet I really woulda loved your smile Did nt really wan na abort but fuck it What s one more lie to tell an unborn child I ve been a liar been a thief Been a lover been a cheat All my sins need holy water Feel it washing over me Oh little one I m sorry I do nt want to admit to something I fucked up If all it s gon na cause is pain The truth in my lies now are falling like the rain So let the river run
Eminem,7dGJo4pcD2V6oG8kP0tJRR,Not Alike (feat. Royce Da 5'9),28FGV3ORH14MYORd7s5dlU, Tay Keith fuck these niggas up Yeah Brain dead eye drops Pain meds cyclops They bed iPod Maybach my bach Trainwrecks sidewalks Pay less hightops KFed iHop Playtex ice spots That s how much we have in common yeah That s how much we have in common whoa Up on this mic we were on it That s how much we have in common yeah That s how much we have in common woo That s how much we have in common We are not alike there s not alike us on the mic yeah I do nt do Jordans and Audemars I do explosions and Molotovs Yall blowing smoke as if yall ai nt washed I blow the smoke from the car exhaust Flying to a party I am not invited to feeling like the streets need me whoa I ai nt got ta dance as long as my Ferrari Spyder move like C Breezy I do nt got ta hire goons I d rather try to buy the moon and breathe freely The sky is blue the tie is new the Masarati white and cool like GEazy While these dudes tryna figure out how to do a freestyle as fly as me I m confused trying to figure out how to do Capri styles am I a G Everybody doing chick joints probably rob these little dudes at fist point Remember everybody used to bite Nickel now everybody doing Bitcoin We do nt got nothing in common no We do nt got nothing in common no Yall in the stuff like doubledup Styrofoam cups on them uppersanddowners woo I m into stuff like doubling commas Find me a brother who s solid To count the shit up then bust the shit down When the cops set us up we can flush the shit down We can no give a fuck shit a fucking Kehlani Selling your cock and your butt for a follower Possible cup for dollars you powder sniff Now you re slipping call it a power trip A product of politics Yall went from profit and topping the charts To dropped in the park in a pile of shit Knowledge is power but powerless if you got it and you do not acknowledge it Yall music sound like Dr Seuss inspired it Hiring strippers prostitutes retiring We can spit it for ya it vans I m fit to be king you re cut out to fit in prince pants You niggas Brain dead eye drops Pain meds cyclops They bed iPod Maybach my bach Trainwrecks sidewalks Payless hightops KFed iHop Playtex ice spots That s how much we have in common yeah That s how much we have in common whoa Up on this mic we we re on it That s how much we have in common yeah That s how much we have in common woo That s how much we have in common We are not alike there s not alike us on the mic yeah You say you re affiliated with murderers killers ay The people you run with are fucking gang But you re just a wan na be gunner gang Like you was gon na do something Acting like you catching bodies ay And you got juice lil youngin you re bugging You ai nt never even been charged in connection with battery bitch you ai nt plugged in nothing Rap god spit lyrical bullets boom And gats cock your partners better tool up This has not to do with muscular But have guns for sure you better put up Strap on in other words if you re a gunner Roll up with your gang You re gon need a arsenal Cause this bar is over your head So you better have arms if you re gon na pull up skrt Oh you run the streets huh Now you wan na come and fuck with me huh This little cocksucker he must be feeling himself He wants to keep up It s tough to me now so he does a feature Decides to team up with Nina But next time you do nt got ta use Tech N9ne if you wan na come at me with a submachine gun And I m talking to you but you already know who the fuck you are Kelly I do nt use sublims and sure as fuck do nt sneakdiss But keep commenting on my daughter Hailie I keep on telling motherfucker bitches in case you forgot Really I need jaw memories jaw like strawberry or pineapple apricot jelly I respond really but this time Shady bout to sound off like a fucking cocked semi Glock Demi god let me put a silencer on this little nonthreatening blond fairy cornball taking shots at me You re not ready fool break yourself like Rocksteady Crew Obviously I m not getting through We can get it poppin like Redenbach letting off like Remy Ma Heavy artillery got ta deal a harsh with a hard shell Put a motherfucking heart in bigger than Bizarre s belly Only time you ll ever say I lost You ll be talking bout Fetty Wap better call Diddy Just to try to get me off and you better hope I do nt call Trick Trick Bitch this shit do nt fly in our city Punk you do nt disrespect OG s RIP Prodigy Soldier in my soul and I told them the moment he signed me that I ll be the most hated dumbhated soldier There s no shame it s okay to own it cause life is a bitch it s a bowlegged hoe But now days are over I Harvey Weinstein a bathrobe hanging over My code name is groper I roleplay with lotion I fucked the whole world then I throw away the Trojan Olay the hoes like with homemade explosives I blow eighty holes in you Do nt make me go in I OJ the flows and I m insult to injury Roll dice to globe in and I m tryna throw in They both hate to choke and my hoe play the And I doubleedge sworded cause one place I poke and I stick and I turn and I rotating motion Invisible with the pen I m at the pinnacle of sick individuals take my dick and put the tip in At minimal I m fucking these syllables I let them lick on my genitals I m a fucking invisible indefensible despicable difficult prick a little bit unpredictable I spit the formiddable that you re bitches are fucking with the original I can say that me and Nickel are identical But not us the only thing we have in common is I m a dick and you suck Otherwise one has nothin to do with the other None comes close to Skunk bug solider Tongue shrub shoulder One mother older Sponge mob colder None rug hoaster Lug nut coaster Lung jug roaster Young Thug poster Unplugged toaster That s how much we have in common yeah That s how much we have in common whoa Up on this mic we were on it yeah That s how much we have in common yeah That s how much we have in common woo That s how much we have in common We are not alike there s not alike us on the mic Man fuck this shit let s go
Eminem,7dGJo4pcD2V6oG8kP0tJRR,Greatest,2XTquzYQAdT1Hk78bOUwsv, Motherfuckers talkin crazy yeah sayin I should quit yeah I fuckin tell them make me bitch eat a fuckin dick yeah I m feelin like the greatest woo wan na be whoever did it Mike Will the one who made it it s Shady on the lyrics I m somewhat outlandish they say You say that we re cut from the same cloth but I guess you fabricate eh You better bring more men than the latter day saints Manic states even padded with automatic stay pray Gat anything that may stay in their way As I stand at the bay window with a hand grenade And a tray eh at the Mandalay Bay Common sense I m a dollar short and a day late James Holmes at the Saturday Batman matinee Must have missed my catscan that day I just threw a Tampax at Dre Trashcan tasks cam and ashtray I m turning back to a madman ca nt take anymore But I try to get away from the anger and rage my basic alias is an A to the K Get your ass spayed like bidets breakin your legs ai nt givin ways ankle The ways you chumps do nt even know how to do somethin to give goosebumps a day when you say That somethin you wo nt give someone a lump in their throat if you had them choked up you d be yankin my chain Feelin like I m headed for a padded cell the Bar for me what I rap is it there But guess that s the standard I m held to But if somethin like that does nt tell you You set a mark too high when platinum sales are looked at as a failure But you better take it back to the shelter and Hamburger Helper cause dammit I m still the Greatest in the world greatest in the world greatest in the world No lie I might be The best to ever do it the best to ever do it the best to ever do it I feel like the greatest joker to honkey sounding like me Never be as good never be as good Packing up wifebeaters white tshirts but what I m the greatest So you sold 10 million albums eh What Only problem is you put out 10 million albums eh Haha Wait what was I just about to say Oh yeah let me get this out the way I know there s people that are pissed about the way I misprounouced a name Die antwoord Fuck I still ca nt say the shit But how quickly they forget who the fuck I was Now ninja try to duck my slugs to let ya girl get fucked by monks I d like to give a shout to Cypress This ca nt be real you dissed me and I was just tryin to give you a shout Now get the fuck out my rhyme book No more shiners already too much time tokin rappers I hear you talkin shit I m just too big to respond to it God forbid I forget go and jump out the window somebody better childproof it Cause if I lose it we can rewind to some old Ja Rule shit And I can remind motherfuckers I ll do shit You do nt got the tools I got my toolkit I bullshit you not Yall fools just forgot that I m so fuckin awful with the thoughts And when I m hostile and impossible to stop So you call it an Austral cause it s not gon na ever I ll never let up on the pedal might as well get the mop Cause I m wiping everyone up in this genre Cause on the mic I fee like I m the Greatest in the world greatest in the world greatest in the world No lie I might be The best to ever do it the best to ever do it the best to ever do it I feel like the greatest joker to honkey sounding like me Never be as good never be as good Packing up wifebeaters white tshirts but what I m the greatest Oh yeah and one more thing I want to mention Is you re one dimension I m a monkey wrench and I can flunk detention I love contentions so welcome to the gun convention Muscles flexin got ta strut like I flunked suspension And you just stuck the key up in the ignition And gave me enough gas to flood my engine yeah Psychopath Michael s Jack s blowin up like a raft I just slapped ISIS with a ISIS flag bet you I come back twice as bad uh Revival did nt go viral Denaun and Royce tell me that I should take the high road Fuck that I m finna hip back till I run out of gun powder and split the scene Hold the mic like similar to pistol squeeze And I shoot from the hip when I grip them things And my lips and the clips got the cig lit like it s nicotine drinking gets mean Bars on these boys when I split them schemes That s why I call the motherfuckers M16s Float like a butterfly Ima sting like a bee you ai nt harming a thing I get a day hard as I m gon na swing I m gon na need to put my arm in a sling But like a wedding band you got ta be diamond to even climb in the ring An anomaly I m Muhammad Ali cause I know one day I m gon na be the Greatest in the world greatest in the world greatest in the world No lie I might be The best to ever do it the best to ever do it the best to ever do it I feel like the greatest joker to honkey sounding like me Never be as good never be as good Packing up wifebeaters white tshirts but what I m the greatest
Eminem,7dGJo4pcD2V6oG8kP0tJRR,Kamikaze,2gsNpSn7VvvJuSrIDfRoYy, Okay how do I say this fack fack fack Last year did nt work out so well for me fack fack fack fack last year 2018 welp fack fack Yeah I m a fucking kamikaze crashing into everything You beat me Islamic Nazi that means there is no such thing I ve been going for your jugular since Craig G Duck Alert Wedgie in my underwear the whole bedsheet and the comforter Stuck up in my rectal crack kiss my disrespectful ass I ll ride through your culdesac Window cracked bumpin your reference tracks You collab on a referent rap I have never said his raps Overstayed my welcome Stepped in crap and ruined your welcome mat So spit that shit from the heart you did nt write like you wrote it While I Tbagged the microphone cause I go nuts on it Like a fighter jet lined with explosives that ll strike any moment Headed right at opponents and I m the fucking pilot that flown it I m bout to Smash into everyone crash into everything Back and I just begun FACK 2017 Fack fack on everyone Fack fack on everyone Fack fack on everyone I m a Kamikaze gon na Smash into everyone crash like an F15 Damage already done yall shoulda let me be Fack fack on everyone Fack fack on everyone Fack fack on everyone I m a Kamikaze gon na I turned on rap cause it made me feel tough when I wasnt From the moment I heard rap was cussin I wasnt Which is why I identify with the guy who I was invented by Dre s Frankenstein energized like a nine volt Ice cold like Snake Eyes buy some rope on a dice roll But if the only reason I blow is cause I m white though Why do nt every other white rapper sell what I sold ooh Kamikaze pilot I wrote my suicide note Here come the guys in white coats tryna stop me Fore I jump behind the controls and try to fly into foes Cause I m takin yall with me when I go cyclone I do nt think this typhoon s letting up any time soon here I go Eyes closed blindfolded I m bout to Smash into everyone crash into everything Back and I just begun FACK 2017 Fack fack on everyone Fack fack on everyone Fack fack on everyone I m a Kamikaze gon na Smash into everyone crash like an F15 Damage already done yall shoulda let me be Fack fack on everyone Fack fack on everyone Fack fack on everyone I m a Kamikaze gon na Smash Kamikaze kamikaze Kamikaze kamikaze kamikamikaze Look at what I ve done I heard your freestyle on Shade 45 that shit was embarrassing There is no way we ever hear that shit again I guarantee That way that shit was so ass it s something we would nt dare reair it Shit s embarrassing is me rear ending Terreri Bear In my therapy chair my dick is the hair length of Cher Each nut is the chair with beware Lyrically I m terrible better get your lyrics prepared Richard Ramirez is here Serially killing every therapist is it Wait wait got the eeriest feeling something evil is lurking I m no conspiracy theorist but something here is afoot Oh yeah it s my dick Get the measurement stick what Twelve inches of wood Wait but I ve been going for your jugular like Craig G Duck Alert And I ve come to pay respects cause if you sleep you re fucked Other words you get laid to rest And I hope your butt is hurt Put me on a track I go cray on it like a color book You got some views but you re still below me Mine are higher so when you compare our views you get overlooked And I do nt say the hook unless I wrote the hook And now I m just freestylin in the vocal booth And you know I ve always spoke the truth You lyin through your teeth so much you broke a tooth And it ai nt somethin I need a phone to do When I say I ca nt wait till I get ahold of you And I do nt know what I m sposed to do Line up the rappers take my pic like a photo shoot
