Artist,Artist_id,Song,Song_id,Lyrics
Eminem,7dGJo4pcD2V6oG8kP0tJRR,Lucky You (feat. Joyner Lucas),60SdxE8apGAxMiRrpbmLY0, Whoa Joyner Joyner yeah yeah yeah Yeah I done did a lot of things in my day I admit it I do nt take back what I say if I said it then I meant it All my life I want a Grammy but I ll prolly never get it I ai nt never had no trophy or no motherfuckin ribbon Fuck the system I m that nigga bend the law cut the rules I m about to risk it all I ai nt got too much to lose Yall been eatin long enough it s my turn to cut the food Pass the plate Where my drink This my day lucky you Fuck you too woo Yall got ta move yall got ta move yall got ta move Give me some room give me some room give me the juice Hop out the coupe hop out the coupe hop out and shoot Yall got ta move yall got ta move give me the juice Back on my bullshit my back to the wall Turn my back on you all of you finished Back to these bullets it s back to the job Pull my MAC out and all of you runnin Back on my hood shit it s back to the pushin These packs and I m actually pumpin Ca nt fuck with you rappers you practically suckin You mighta went platinum but that do nt mean nothin I m actually buzzin this time Straight out the kitchen I told em the oven is mine I do not fuck with you guys If I do nt kill you just know you gon suffer this time I ai nt no gangster but I got some bangers Some chains and some blades and a couple of knives Choppers and jammies a partridge a pear tree My twelve days of Christmas was nothin but lies I run at you hard like a sumo sumo They say I talk like a chulo chulo I live in Mars I m not Bruno woo Bitch I m a dog call me Cujo rah You play your cards I reverse on you all And I might just drop all like a Uno bup Cllate boca mejor maricn little puto and all of you culo They ve invented a level off in the ghetto to ghetto Lookin for somethin I prolly can never find now Shit get relevant until the beef die down In truth a nigga just really want me tied down I ve been alone and I never needed nobody Just only me and my shawty I ll tell these niggas to lie down Keep all of the money I never wanted the lifestyle I just pray to God that my son ll be alright now I said ai nt no love for the other side Or anyone who ever want smoke Joyner When I die I m goin out as the underdog who never lost hope You in the wrong cab down the wrong path Nigga wrong way wrong road Snakes in the grass tryna slither fast I just bought a fuckin lawn mower I have said a lotta things in my day I admit it This is payback in a way I regret it that I did it I done won a couple Grammys but I sold my soul to get em Was nt in it for the trophies just the fuckin recognition Fuck s the difference I m that cracker bend the law fuck the rules Man I used to risk it all now I got too much to lose I been eatin long enough man my stomach should be full I just ate lick the plate my buffet lucky me Fuck you think woo I got a couple of mansions Still I do nt have any manners You got a couple of ghost writers But to these kids it do nt actually matter They re askin me What the fuck happened to hiphop I said I do nt have any answers Cause I took an L when I dropped my last album It hurt me like hell but I m back on these rappers And actually comin from humble beginnings I m somewhat uncomfortable winning I wish I could say What a wonderful feeling We re on the upswing like we re punchin the ceiling But nothin is sealing like anyone has any fuckin ability To even stick to a subject it s killin me The inability to pin humility Hatata batata why do nt we make a bunch of fuckin Songs about nothin and mumble And fuck it I m goin for the jugular Shit is a circus you clowns that are comin up Do nt give an ounce of a motherfuck About the ones that were here before you to make raps it s recap Way back MC s that wreak havoc on tape decks ADAT s with the G raps and Kane s hat We need 3 stacks ASAP and bring Masta Ace back Because half of these rappers have brain damage All the lean rappin face tats syruped out like tree sap I do nt hate trap and I do nt wan na seem mad But in fact with a oldme at the same cat That would take that feedback and aim back I need that But I think it s inevitable They know a button to press or a lever to pull They give me the snap though bitch And if I payin attention I m probably makin it bigger But you ve been takin the dicks in the fuckin back ho get it On the brink in a minute Got me thinkin of finishin everything With acetaminophen then reapin the benefits I m asleep at the wheel again As I peak into thinkin about an evil intent Of another beat Ima kill again Cause even if I got ta end up eating a pill again Even ketamine or methamphetamine with the minithin It better be at least 70 to 300 milligram And I might as well cause Ima end up bein a villain again Levels to this shit I got an elevator You could never say to me I m not a fuckin record breaker I sound like a broken record every time I break a record Nobody could ever take away the legacy I made a navigator Motherfucker know I got a right to be this way I got spite inside my DNA But I wrote till the wheels fall off I m workin tirelessly ay It s the moment yall been waitin for Like California wishin rain would pour And that drought yall have been prayin for My downfall from the 8 Mile to the Southpaws Still the same Marshall that outlaw That they say is a rider mighta fell off But back on that bull like the cowboys So yall got ta move yeah yall got ta move yeah yall got ta move Give me some room give me some room give me the juice Hop out the coupe hop out the coupe hop out and shoot Yall got ta move yall got ta move give me the juice
Eminem,7dGJo4pcD2V6oG8kP0tJRR,Killshot,1jo3TwNGCXfNdB5uba3ZVv, You sound like a bitch bitch Shut the fuck up When your fans become your haters You done Fuck your beard s weird Alright You yellin at the mic you weird beard We doin this once Your beard s weird why you yellin at the mic Rihanna just hit me on the text Last night I left hickeys on her neck Wait you just dissed me I m perplexed Insult me in a line compliment me on the next damn I m really sorry you want me to have a heart attack Was watchin 8 Mile on my NordicTrack Realized I forgot to call you back Here s that autograph for your daughter I wrote it on a Starter cap Stan Stan son listen man dad is nt mad But how you gon na name yourself after a damn gun and have a man bun The giant s woke eyes open undeniable Supplyin smoke got the fire stoked Say you got me in a scope but you grazed me I say one call to Interscope and you re Swayze Your reply got the crowd yelling Woo So before you die let s see who can outpetty who With your corny lines Slim you re old Ow Kelly ooh but I m 45 and I m still outselling you By 29 I had three albums that had blew Now let s talk about somethin I do nt really do Go in someone s daughter s mouth stealin food But you re a fuckin mole hill now Ima make a mountain out of you woo Ho chill actin like you put the chrome barrel to my bone marrow Gunner bitch you ai nt a bow and arrow Say you ll run up on me like a phone bill sprayin lead Playin dead that s the only time you hold still Are you eating cereal or oatmeal What the fuck s in the bowl milk Wheaties or Cheerios Cause I m takin a shit in em Kelly I need reading material Dictionary Yo Slim your last four albums sucked Go back to Recovery oh shoot that was three albums ago What do you know Oops know your facts before you come at me lil goof Luxury oh you broke bitch Yeah I had enough money in 02 To burn it in front of you ho Younger me No you re the whack me It s funny but so true I d rather be 80yearold me than 20yearold you Till I m getting oldaged still can fill a whole page with a 10 year old s rage Got more fans than you in your own city lil kiddy Go play feel like I m babysitting Lil Tay Got the Diddy okay so you spent your whole day Shootin a video just to fuckin dig your own grave Got you at your own wake I m the billy goat You ai nt never made a list next to no Biggie no Jay Next to Taylor Swift and that Iggy hoe you about to really blow Kelly they ll be putting your name Next to Ja next to Benzino die motherfucker Like the last motherfucker sayin Hailie in vain Alien brain you Satanist yeah My biggest flops are your greatest hits The game s mine again and ai nt nothin changed but the locks So before I slay this bitch mwah give Jade a kiss Got ta wake up Labor Day to this the fuck Bein rich aimed by some prick usin my name for clickbait In a state of bliss cause I said his goddamn name Now I got ta cock back aim yeah bitch pop champagne to this It s your moment this is it As big as you re gon na get so enjoy it Had to give you a career to destroy it Lethal injection go to sleep six feet deep I ll give you a B for the effort but if I was three Foot 11 you d look up to me and for the record You would suck a dick to fuckin be me for a second Lick a ballsack to get on my channel Give your life to be as solidified This motherfuckin shit is like Rambo when he s out of bullets So what good is a fuckin machine gun when it s out of ammo Had enough of this tattedup mumble rapper How the fuck can him and I battle He ll have to fuck Kim in my flannel I ll give him my sandals Cause he knows long as I m Shady he s gon have to live in my shadow Exhausting letting off on my offspring Like a gun barrel bitch get off me You dance around it like a sombrero we can all see You re fuckin salty cause Young Gerald s ballsdeep inside of Halsey Your red sweater your black leather You dress better I rap better That a death threat or a love letter Little white toothpick Thinks it s over a pic I just do nt like you prick Thanks for dissing me Now I had an excuse on the mic to write Not Alike But really I do nt care who s in the right But you re losin the fight you picked Who else want it Kells Attempt fails Budden Ls Fuckin nails in these coffins as soft as Cottonelle Killshot I will not fail I m with the Doc still But this idiot s boss pops pills and tells him he s got skills But Kells the day you put out a hit s the day Diddy admits That he put the hit out that got Pac killed ah I m sick of you bein whack And still usin that motherfuckin AutoTune so let s talk about it let s talk about it I m sick of your mumble rap mouth Need to get the cock up out it before we can even talk about it talk about it I m sick of your blonde hair and earrings Just cause you look in the mirror and think you re Marshall Mathers Marshall Mathers Do nt mean you are and you re not about it So just leave my dick in your mouth and keep my daughter out it You fuckin oh And I m just playin Diddy you know I love you
Eminem,7dGJo4pcD2V6oG8kP0tJRR,The Ringer,2jt2WxXMCD4zjACthkJQVE, Yo Yo I m just gon na write down my first thoughts and see where this takes me Cause I feel like I wan na punch the world in the fuckin face right now Yeah let me explain just how to make greatness Straight out the gate I m bout to break you down Ai nt no mistakes allowed but make no mistake I m bout To rape the alphabet I may raise some brows If I press the issue just to get the anger out blllt Full magazine could take Staples out Savage but ai nt thinking bout no bank account But bitch I m off the chain like Taylor Brown Motherfucker shut the fuck up when I m talkin lil bitch I m sorry wait what s your talent Oh critiquin My talent Oh bitch I do nt know who the fuck yall are To give a subpar bar Even have an opinion if you you mention me Millions of views attention the news I mention you loselose for me winwin for you Billions of views your ten cents are two Skim through the music to give a shit reviews To get clicks but bitch you just lit the fuse Do nt get misconstrued business as us Shitlist renewed so get shit to do Or get dissed cause I just do nt get what the fuck half the shit is that you re listening tto Do you have any idea how much I hate this choppy flow Everyone copies though Probably no Get this fuckin audio out my Audi yo adios I can see why people like Lil Yachty but not me though Not even dissin it just ai nt for me All I am simply is just an emcee Maybe Stan just is nt your cup of tea Maybe your cup s full of syrup and lean Maybe I need to stir up shit preferably shake the world up if it were up to me Paul wants me to chill yall want me to ill I should eat a pill probably I will Old me kill the new me watch him bleed to death I breathe on the mirror I do nt see my breath Possibly I m dead I must be possessed Like an evil spell I m EVIL evil but spelled Jam a Crest white strip in the tip of my dick with an ice pick Stick it in a vice grip hang it on a spike fence Bang it with a pipe wrench While I take my ballsack and flick it like a light switch Like vicepresident Mike Pence Back up on my shit in a sidekick as I lay it on a spike strip These are things that I d rather do than hear you on a mic Since ninetenths of your rhyme is about ice and Jesus Christ man how many times is someone gon na fuck on my bitch Fuck my side chick You will never see Em icy but as cold as I get on the MIC I polarize shit so the Thames might freeze And your skull might split like I bashed you upside it Bitch I got the club on smash like a nightstick yeah Turn down for what I ai nt loud enough Nah turn the valium up Cause I do nt know how I m gon na get your mouths to shut now When it does nt matter what caliber I spit at I ll bet a hundred thousand bucks you ll just turn around and just be like Man how the fuck sourpuss gon na get mad just cause his album sucks and now he wants to take it out on us ooh But last week an exfan mailed me a copy of The Mathers LP to tell me to study It ll help me get back to myself and she ll love me ooh I mailed the bitch back and said if I did that I d just be like everyone else in the fucking industry Especially an effing Recovery clone of me So fingerbang chicken wang MGK Iggy zae Lil Pump Lil Xan imitate Lil Wayne I should aim at everybody in the game pick a name I m fed up with being humble And rumor is I m hungry I m sure you heard bumblings I heard you wan na rumble like an empty stomach I heard your mumbling but it s jumbled in mumbojumbo The era that I m from will pummel you That s what it s comin to What the fuck are you gon na do where you runnin to I m gon na crumble you and I ll take a number two And dump on you if you ai nt Joyner If you ai nt Kendrick or Cole Or Sean then you re a goner I m bout to bring it to anyone in this bitch who want it I guess when you walk into BK you expect a Whopper You can order a quarter pounder when you go to McDonalds But if you re lookin to get a porterhouse you better go get Revival But yall are acting like I tried to serve you up a slider Maybe the vocals should have been autotuned and you would have bought it But sayin I no longer got it cause you missed the line and never caught it Cause it went over your head because you re too stupid to get it Cause you re mentally retarded but pretend to be the smartest With your expertise and knowledge but you ll never be an artist And I m harder on myself than you could ever be regardless What I ll never be is flawless all I ll ever be is honest Even when I m gone they re gon na say I brought it Even when I hit my forties like a fuckin alcoholic With a bottle full of malt liquor But I could nt bottle this shit any longer The fact that I know that Ima hit my bottom if I dont Pull myself from the jaws of defeat And rise to my feet I do nt see why yall even started with me I get impeached My enemies die I do nt ceasefire till at least all are deceased I m eastside never be caught slippin Now you see why I do nt sleep Not even a wink I do nt blink I do nt doze off I do nt even nod to the beats I do nt even close my fuckin eyes when I sneeze Aw man That BET cypher was weak it was garbage The Thing ai nt even orange Oh my God that s a reach Shout to all my colorblind people Each and every one of yall If you call a fire engine green aquamarine Or you think water is pink Dawg that s a date Looks like an olive to me Look there s an apple No it s not it s a peach So fingerbang Pootie Tang Burger King Gucci Gang dookie dang Charlamagne gon na hate anyway Does nt matter what I say Give me Donkey of the Day What a way for 2018 to get underway But I m gon na say everything that I wan na say Welcome to the slaughterhouse bitch yeah Invite them in like a one a day I m not done preach Cause I feel like the beast of burden That line in the sand was it even worth it Cause the way I see people turnin Is makin it seem worthless It s startin to defeat the purpose I m watchin my fan base shrink to thirds And I was just trying to do the right thing but word Has the court of public opinion reached a verdict Or still yet to be determined Cause I m determined to be me critique the worship But if I could go back I d at least reword it And say I empathize with the people this evil serpent sold the dream to that he s deserted But I think it s workin These verses are makin him a wee bit nervous And he s too scared to answer me with words Cause he knows that he will lyrically get murdered But I know at least he s heard it Cause Agent Orange just sent the Secret Service To meet in person To see if I really think of hurtin him Or ask if I m linked to terrorists I said Only when it comes to ink and lyricists But my beef is more media journalists Hold up hold up hold up I said my beef is more meaty a journalist They can get a mouthful of flesh And yes I mean eating a penis Cause they been panning my album to death So I been giving the media fingers Do nt wan na turn this to a counselling sesh But they been puttin me through the ringer So I ai nt ironin shit out with the press But I just took this beat to the cleaners
Eminem,7dGJo4pcD2V6oG8kP0tJRR,'Till I Collapse,4xkOaSrkexMciUUogZKVTS, Cause sometimes you just feel tired Feel weak and when you feel weak you feel like you wan na just give up But you got ta search within you you got ta find that inner strength And just pull that shit out of you and get that motivation to not give up And not be a quitter no matter how bad you wan na just fall flat on your face and collapse Yo left yo left yo left right left Yo left yo left yo left right left Yo left yo left yo left right left Yo left yo left yo left right left Till I collapse I m spilling these raps long as you feel em Till the day that I drop you ll never say that I m not killing them Cause when I am not then Ima stop penning em And I am not hiphop and I m just not Eminem Subliminal thoughts when I m stop sending them women are caught in webs spin and hauk venom Adrenaline shots of penicillin could not get the illing to stop Amoxacilin is just not real enough The criminal cop killing hiphop filling a minimal swap to cop millions of Pac listeners You re coming with me feel it or not you re gon na fear it like I showed you the spirit of god lives in us You hear it a lot lyrics that shock is it a miracle or am I just a product of pop fizzing up For sizzle my whizzle this is the plot listen up you bizzles forgot slizzle does not give a fuck Till the roof comes off till the lights go out Till my legs give out can t shut my mouth Till the smoke clears out am I high Perhaps Ima rip this shit till my bone collapse Till the roof comes off till the lights go out Till my legs give out can t shut my mouth Till the smoke clears out am I high Perhaps Ima rip this shit till my bone collapse Music is like magic there s a certain feeling you get when you re real And you spit and people are feeling your shit This is your moment and every single minute you spend trying to hold onto it cause you may never get it again So while you re in it try to get as much shit as you can And when your run is over just admit when it s at its end Cause I m at the end of my wits with half this shit that gets in I got a list here s the order of my list that it s in It goes Reggie JayZ Tupac and Biggie Andre from OutKast Jada Kurupt Nas and then me But in this industry I m the cause of a lot of envy so when I m not put on this list the shit does not offend me That s why you see me walk around like nothing s bothering me Even though half you people got a fucking problem with me You hate it but you know respect you ve got to give me The press s wet dream like Bobby and Whitney Nate hit me Till the roof comes off till the lights go out Till my legs give out can t shut my mouth Till the smoke clears out am I high Perhaps Ima rip this shit till my bone collapse Till the roof comes off till the lights go out Till my legs give out can t shut my mouth Till the smoke clears out am I high Perhaps Ima rip this shit till my bone collapse Soon as a verse starts I eat it at MC s heart What is he thinking How not to go against me Smart And it s absurd how people hang on every word I ll probably never get the props I feel I ever deserve But I ll never be served my spot is forever reserved If I ever leave earth that would be the death of me first Cause in my heart of hearts I know nothing could ever be worse That s why I m clever when I put together every verse My thoughts are sporadic I act like I m an addict I rap like I m addicted to smack like I m Kim Mathers But I don t want to go forth and back in constant battles The fact is I would rather sit back and bomb some rappers So this is like a full blown attack I m launching at them The track is on some battling raps who want some static Cause I don t really think that the fact that I m Slim matters A plaque of platinum status is whack if I m not the baddest Till the roof comes off till the lights go out Till my legs give out can t shut my mouth Till the smoke clears out am I high Perhaps Ima rip this shit till my bone collapse Till the roof comes off till the lights go out Till my legs give out can t shut my mouth Till the smoke clears out am I high Perhaps Ima rip this shit till my bone collapse Until the roof Until the roof The roof comes off The roof comes off Until my legs Until my legs Give out from underneath me Give out form underneath me I I will not fall I will stand tall Feels like no one can beat me
