Artist,Artist_id,Song,Song_id,LyricsDrake,3TVXtAsR1Inumwj472S9r4,Now & Forever,4zLOwx1yRJXWkHKt1XzF1p, It s over yeah it s over yeah I m leaving I m gone I ca nt stay here no more and I ca nt sleep on the floor Man I m leaving I m leaving you know I got my reasons Yeah I m leaving yeah I m leaving yeah I m leaving I m gone Yeah I m leaving I m gone I had to knock down the wall Yeah I swear to god that I m gone I m leaving I m leaving No looking back when I m gone No looking back when I m gone No more no more no more no more No more no more no more no more No more no more no more no more No more no more no more no more It s over yeah it over yeah I m leaving I m gone I ve been doing this wrong I ve been here for too long Yeah I m leaving I m leaving you know I got my reasons Yeah I m leaving yeah I m leaving I m leaving I m gone I do nt wan na miss the boat I do nt wan na sit in coach I do nt wan na sit in home I got ta get where I m going I m afraid Imma die before I get where I m going I know Imma be alone I know I m out on my own I just got ta hit the road I just got ta know the road I just got ta hit a road I just got ta know the road I just got ta know the road Something is said do nt say that again I just been out and bad from way back when I ca nt be out here on no laid back shit I ca nt be out here on no laid back shit You got something to say then say that thing I just been out and bad from way back when I got ta get on the road I got ta get on the road I ai nt looking back no more no no no No more no more no more no more No more no more no more no more No more no more no more no more no more no more I got ta go out and get want you to know what I did Want you to know how it went That s why I keep telling you over and over again Just let me go just let me go let me bring it home to you Just let me go let me bring it home to you Now and forever I ll bring it home to you Just let me go let me bring it home Let me go let me bring it home to you Let me go let me bring it home to you Let me go let me bring it home Now and forever I ll bring it home to you Let me go let me bring it home to you Let me go let bring bring it home to you Now and forever I ll bring it home Now and forever I ll bring it home
Drake,3TVXtAsR1Inumwj472S9r4,Company,6ImxYXeLDQPIv4qo7bMhSk, I got some shit for you to come and get I m at the St Regis up on Briar Oaks hit me when you done your shift I see you doin well baby Oh you pullin shit together I can tell baby Is you single or what I need a girl from the country I need a girl from Kentucky I need a shawty from Houston I need a girl who gon love me I need a girl who gon trust me Someone to fuck me Someone to make me feel lucky Someone that s so proud to be with me She walk right up to her ex look him dead in the face And say You ai nt got the juice like that You ai nt got the juice like that That s cold ice cold girl you ai nt have to do him like that Why you had to do him like that Got ta come through quick quick Oh you at the club cashin out with Eric Hit me when you done your shift I know a girl I should propose to but we just on some different shit She on some up at 9AM already cookin in the kitchen shit And lately we ve been fightin on some whyyoulovethestrippinshit Yeah she workin with the spatula I know she love flippin shit All on me I do nt deserve it She s just a little too perfect She s just a little too worth it I do nt deserve her at all no not at all I only text her man I never call I m still a canine at heart I m a dog Yeah that s why you got ta come through quick quick I m posted at the Derek up on Westheimer hit me when you re done your shift I need some company I need some company I need you to take my mind off being in my prime Some company I m on a Mo City trip I m on a Mo City trip right now A Mo City trip right now Mo City trip Mo City trip right now It s a couple faces in here that a nigga piped down So let s go find a place that we can sip right now Tour round the city it s the shit right now It s kinda lit right now that you re here right now Pop a couple percs let s get it in right now Saturday nights off in my bed right now Call up your girl and put them heels on It s gettin rowdy rowdy right now I m on a Mo City trip I m a dog Ima dog I m in heat baby heat baby I m a dog I go ham I m a hog Bitch so bad coulda thought I owed her somethin By the way I broke her off What she get in to when we take it off Drink so long for a year I did nt cough Fantasizin and fistin and switchin up positions Do you mind if we just menage just a little Mo City trip Mo City trip right now
Drake,3TVXtAsR1Inumwj472S9r4,You & The 6,2YaDRtIlQiZ5WDDB2YuEOC, Having conversations with mama man my life is a mess Ai nt been returning the texts so she been reading the press She got Google alerts them shits go straight to her phone She worry bout me from home you know she raised me alone She said I heard you back with you know who I told her Girl I m always back with you know who And she like Who are we kidding You re only 27 you just being you You re your fathers child man thank god you got some me in you At least I always at least I always see it through At least I m always being true to what you taught me Retired teacher but your words still got me evolving Never get sloppy drunk but alcohol is problem solving And look I hate it when you hate on all my girlfriends And assistants always convinced that there s always someone better Like that girl from that gym who trains you I know you wan na arrange it you told me she s free Thursday And I m sure that she s a angel but she do nt want this life The timing ai nt right Maybe one day but even one day with us is a time of a life We do things that people pay to document You got the sweetest heart but I m not here to give out compliments or boost nobody confidence momma I got no friends in this momma I do nt pretend with this momma Ion joke with this momma I pull the knife out my back and cut they throat with it momma I m Game of Thrones with it momma I m Home Alone with it momma I m t I really hate using this tone with you momma I really hate getting aggressive on this phone with you momma I really hate wasting your time to check a clone or two momma It s just they cloning me momma Them niggas wannabes momma It s like I m the one they wan na be momma I just I I ca nt be out here being vulnerable momma I mean I kill em every time they do a song with me momma I sing a hook they sing along with me momma What more they want from me momma Yeah this is a crazy life But you and the six raised me right Do nt ever take advice that was great advice You and the six raised me right that shit saved my life Having conversations with momma we start talkin bout dad You know he dropping a single he saying this is his window That nigga still wearing linen that nigga still in the club Call him after we get off the phone and show him some love That nigga Memphis for real girl he love you to death He made mistakes throughout his life that he still does nt accept But he just want our forgiveness and fuck it look how we living I m content with this story who are we not to forgive him At least I been to a prison at least I know what it s like I used to rap on the phone one of his friends doing life And now I got me a Grammy that could be part of the reason Let s just call this shit even we got some things to believe in Do you remember back to Weston Road Scarlett Road Hangin with Aaron Bell and Reny shit could ve gone south for me he looked out for me ma He never let me do drugs He let me shoot a gun one summer but out there everyone does He made me listen to his music old music soul music Shit that can only be created if you go through it I used to get teased for being black and now I m here and I m not black enough Cause I m not acting tough or making stories up bout where I m actually from But I just roll with it momma rolling stone with it momma Got ta be careful around rolling stones or anyone that s tryna throw stones at me momma I m not condoning it momma They will not tear nothing down I built this home for you momma Know I do nt call enough momma I just been working with so little time for personal momma Hard labor let me pay the price You and the six raised me right that shit saved my life
Drake,3TVXtAsR1Inumwj472S9r4,Jungle,7JXZq0JgG2zTrSOAgY8VMC, Rock me real slowly Put a bib on me I m just like a baby drooling over you The things you do These days I m letting God handle all things above me The things I ca nt change are the reasons you love me Listen you can hear them calling my name I m all over the place I ca nt sit in one place I m not ashamed at all Still findin myself let alone a soulmate I m just sayin Feel like we one and the same our relationship changed That or it never existed Whenever they say somethin bout us you listen But fuck what they talkin about on your timeline That s cuttin all into my time with you Fuck what they talkin about on your timeline That s cuttin all into my time with you Rock me real slowly Put a bib on me I m just like a baby drooling over you The things you do She said you re my everything I love you through everything I done did everything to her She forgave me for everything this a forever thing Hate that I treated like it s a whatever thing Trust me girl this shit is everything to me She from the Jungle she from the Jungle I take somebody else s car drive there undercover This shit is everything to me this shit is everything Do nt know where we stand I used to hit you bout everything Are we still good Are we still good Are we still good Are we still good If I need to talk are you around Are you down for the cause Are you down Are you down Are you down Are you down for the cause Are you down Are you down Are you down Are you down for the cause You still down You still down You still down Rock me real slowly Put a bib on me I m just like a baby drooling over you The things you do These days these new girls got me nervous They go to school and do bottle service They ca nt decide they keep switching majors Being indecisive makes me anxious Call your number and it s out of service Who can I call for your information What am I supposed to do after we done everything we do Who is your replacement Are we still good Are we still good Are we still good Are we still good
Drake,3TVXtAsR1Inumwj472S9r4,Tuscan Leather,6AGqr1hYRY0rPqw0BrTEnJ, Comin off the last record I m gettin 20 million off the record Just to off these records nigga that s a record I m livin like I m out here on my last adventure Past the present when you have to mention This is nothin for the radio but they ll still play it though Cause it s that new Drizzy Drake that s just the way it go Heavy airplay all day with no chorus We keep it thorough nigga rap like this for all of my borough niggas I reached the point where do nt shit matter to me nigga I reached heights that Dwight Howard could nt reach nigga Prince Akeem they throw flowers at my feet nigga I could go a hour on this beat nigga I m just as famous as my mentor But that s still the boss do nt get sent for Get hype on tracks and jump in front of a bullet you was nt meant for Cause you do nt really wan na hear me vent more Hot temper scary outcome Here s a reason for niggas that s hatin without one That always let they mouth run Bench players talkin like starters I hate it Started from the bottom now we here nigga we made it Yeah Tom Ford Tuscan Leather smelling like a brick Degenerates but even Ellen love our shit Rich enough that I do nt have to tell em that I m rich Self explanatory you just here to spread the story wassup Sittin Gucci Row like they say up at UNLV Young rebel Young Money nothin you could tell me Paperwork takin too long maybe they do nt understand me I ll compromise if I have to I got ta stay with the family Not even talkin to Nicki communication is breakin I dropped the ball on some personal shit I need to embrace it I m honest I make mistakes I d be the second to admit it Think that s why I need her in my life to check me when I m trippin On a mission tryna shift the culture Tell me who dissin I got some things that ll hit the culprit Them strep throat flows them shits to stop all of the talkin All of the talkin got one reply for all of your comments Fuck what you think I m too busy that s why you leave a message Born a perfectionist guess that makes me a bit obsessive That shit I heard from you lately really relieved some pressure Like aye B I got your CD you get an E for effort I piece letters together and get to talkin reckless I do nt change like credentials you know you see the necklace My life s a completed checklist I m tired of hearin bout who you checkin for now Just give it time we ll see who s still around a decade from now That s real How much time is this nigga spendin on the intro Lately I ve been feelin like Guy Pearce in Memento I just set the bar niggas fall under it like a limbo The family all that matters I m just out here with my kinfolk Off everything my pen wrote we went from Bundy to Winslow This for shorty up on Glengrove who love when I catch my tempo I sip the Pora and listen to Cappadonna The Fresh Prince just had dinner with Tatiana no lie All these 90 s fantasies on my mind The difference is that with mine they all come true in due time I might come through without security to check if you re fine That s just me on my solo like fuck it like YOLO Wanted to tell you Accept yourself You do nt have to prove shit to know and except yourself And if you end up needing some extra help then I can help You know back on your feet and shit Tryna get my karma up fuck the guilty and greedy shit How much time is this nigga spendin on the intro How this nigga workin like he got a fuckin twin though Life is soundin crazy 40 on Martin Scorcese And I would nt change a thing if you paid me now real nigga wassup
Drake,3TVXtAsR1Inumwj472S9r4,Furthest Thing,1BHgt2kxZs4N6WWdDxsaEk, Somewhere between psychotic and iconic Somewhere between I want it and I got it Somewhere between I m sober and I m lifted Somewhere a mistress and commitment But I stay down girl I always stay down Get down have her lay down Promise to break everybody off before I break down Everyone just wait now So much on my plate now People I believed in they do nt even show their face now What they got to say now Nothing they can say now Nothing really changed but still they look at me away now What more can I say now What more can I say now You might feel like nothing was the same I still been drinking on the low Mobbin on the low Fuckin on the low Smokin on the low I still been plotting on the low Scheming on the low The furthest thing from perfect Like everyone I know I still been drinking on the low Mobbin on the low Fuckin on the low Smokin on the low I still been plotting on the low Scheming on the low The furthest thing from perfect Like everyone I know And I hate that you do nt think that I belong to ya Just too busy running shit to run home to ya You know that paper my passion Bittersweet celebrations I know I ca nt change what happened I ca nt help it I ca nt help it I was young and I was selfish I made every woman feel like she was mine and no one elses And now you hate me Stop pretending stop that fronting I ca nt take it Girl do nt treat me like a stranger Girl you know I seen ya naked Girl you know that I remember do nt be a pretender Getting high at the condo that s when it all comes together You know I stay reminiscing And makeup sex is tradition But you ve been missing girl And you might feel like nothing was the same I still been drinking on the low Mobbin on the low Fuckin on the low Smokin on the low I still been plotting on the low Scheming on the low The furthest thing from perfect Like everyone I know Drinking smoking fucking plotting Scheming plotting scheming getting money Drinking fucking smoking plotting scheming Plotting getting money This the life for me My mama told me this was right for me I got em worried like make sure you save a slice for me I should have spoons serve you up with a fork and knife for me Your actions make us doubt you Your lack of effort got me rapping different This the shit I wan na go out to Play this shit at my funeral if they catch me slippin Naked women swimming that s just how I m living Donate a million to some children that s just how I m feeling A nigga filling up arenas who the fuck can see us I had to Derrick Rose the knee up before I got the reup Yours truly the boy I just build and build more Yall niggas build and destroy You niggas party too much man I just chill and record No filler you feel it now if you ai nt fill it before Yes Lord this the shit I wan na go out to This the shit I wan na go out to
Drake,3TVXtAsR1Inumwj472S9r4,Started From The Bottom,4HyL2b6eDZL609DNAUgcNP, Started Zombie on the track Started from the bottom now we re here Started from the bottom now my whole team fucking here Started from the bottom now we re here Started from the bottom now the whole team here nigga Started from the bottom now we re here Started from the bottom now my whole team here nigga Started from the bottom now we re here Started from the bottom now the whole team fucking here I done kept it real from the jump Living at my mama house we d argue every mornin nigga I was trying to get it on my own Working all night traffic on the way home And my uncle calling me like Where ya at I gave you the keys told ya bring it right back nigga I just think it s funny how it goes Now I m on the road half a million for a show And we Started from the bottom now we re here Started from the bottom now my whole team fucking here Started from the bottom now we re here Started from the bottom now the whole team here nigga Started from the bottom now we re here Started from the bottom now the whole team fucking here Started from the bottom now we re here Started from the bottom now the whole team here nigga Boys tell stories about the man Say I never struggled was nt hungry yeah I doubt it nigga I could turn your boy into the man There ai nt really much I hear that s poppin off without us nigga We just want the credit where it s due Imma worry about me give a fuck about you nigga Just as a reminder to myself I wear every single chain even when I m in the house Cause we Started from the bottom now we re here Started from the bottom now my whole team fucking here Started from the bottom now we re here Started from the bottom now the whole team here nigga No new niggas nigga we do nt feel that Fuck a fake friend where you real friends at We do nt like to do too much explaining Story stay the same I never changed it No new niggas nigga we do nt feel that Fuck a fake friend where you real friends at We do nt like to do too much explaining Story stay the same through the money and the fame Cause we Started from the bottom now we re here Started from the bottom now my whole team fucking here Started from the bottom now we re here Started from the bottom now the whole team here nigga Started from the bottom now we re here Started from the bottom now my whole team here nigga Started from the bottom now we re here Started from the bottom now the whole team here nigga
Drake,3TVXtAsR1Inumwj472S9r4,Wu-Tang Forever,2IUvajlsKNQhvhCjUwvh5D, I just love when I m with you yeah this shit is on ten We used to be friends girl and even back then You would look at me with no hesitation and you d tell me baby it s yours Nobody else s yeah this shit belong to nobody it s yours Nobody else s yeah this shit belong to nobody in that Well made me think about the game girl And how I switched it up with a new thang Young nigga came through on his WuTang And nowadays when I ask about who got it they say it s yours Nobody else s yeah this shit belong to nobody it s yours Nobody else s yeah this shit belong to nobody it s yours It s yours that s for sure How you feel about coming home with a nigga for the night If you nervous hit the lights I know we only fucking out of spite Cause your man do nt do you right do you right I could fuck you so good Then I hit you with the 9 AM in Dallas who you like baby who you like Machine gun raps for all my niggas in the back Stadium packed just glad to see the city on the map I just gave the city life it ai nt about who did it first It s about who did it right niggas looking like Preach Open cases on me for a half a million each I find peace knowing that it s harder in the streets I know luckily I did nt have to grow there I would only go there cause there s niggas that I know there I do nt know what s getting into me I just like the rush when you see your enemy somewhere in the club And you realize he just not in a position to reciprocate your energy You ai nt ever worried cause he s not who he pretends to be People like Mazin who was a best friend to me Start to become a distant memory Things change in that life and this life started lacking synergy And fucking with me mentally I think it s meant to be Paranoid always rolling with my mothafuckin boys But you got ta understand when it s yours They do nt really leave your ass with a mothafuckin choice I just love when I m with you yeah this shit is on ten We used to be friends girl and even back then You would look at me with no hesitation and you d tell me baby it s yours Nobody else s yeah this shit belong to nobody it s yours Nobody else s yeah this shit belong to nobody in that Well made me think about the game girl And how I switched it up with a new thang Young nigga came through on his WuTang And nowadays when I ask about who got it they say it s yours Nobody else s yeah this shit belong to nobody it s yours Nobody else s yeah this shit belong to nobody it s yours It s yours that s for sure
Drake,3TVXtAsR1Inumwj472S9r4,Own It,7nMV1acq8Owmni25P5gpOw, Own it It s yours It s yours Yours You re still the one that I adore Ai nt much out there to have feelings for Guess who s it is Guess who s it is Guess who s it is Guess who s it is Yours A few bottles on the table a few waters It ai nt a secret baby everybody saw us Guess who s it is Guess who s it is Guess who s it is It s yours Next time we fuck I do nt want to fuck I want to make love Next time we talk I do nt want to just talk I want to trust Next time I stand tall I want to be standing for you And next time I spend I want it all to be with you Peaking I m peaking wake up with me this weekend weekend Guess who s it is Guess who s it is Guess who s it is It s yours Own it own it own it own it Own it own it own it own it Own it own it own it own it Own it own it own it own it I said go own that shit Own that shit own that shit Own that shit go own that shit Own that shit own that shit Own that shit own that shit Go own that shit Own it own it own it own it Own it own it own it own it Own it own it own it own it Own it own it own it own it I said go own that shit Own that shit own that shit Own that shit go own that shit Own that shit own that shit Own that shit own that shit Go own that shit Niggas talk more than bitches these days Just let that shit sink in Niggas talk more than bitches these days Who could get the pussy quicker these days Still straight with the weed and the liquor these days Cause the new drugs got the kids trippin these days Bunch of journalists been searchin for a story My exgirl been searchin for a sorry Couple bitches tryin to have me on the Maury like nigga it s yours You should be supportin but where you been at On tour gettin money Yall do nt even really check for me You ai nt even hit me when that nigga had threats for me Girl you do nt love me you just say that shit to get to me Girl cause you got the Batphone in my workline You should call it When the last time you did something for the first time You have done it all swear to God Niggas talk more than bitches these days Got you thinkin I m different these days Broken telephone for every single conversation By the time it gets to you shit switches these days It s yours it s your it s yours it s always gon na be yours Own it own it own it own it Own it own it own it own it Own it own it own it own it Own it own it own it own it own it It s yours yeah It s yours own it Own It Own It Own It Own It Baby own it It s yours Own that shit own that shit Own that shit
