Artist,Artist_id,Song,Song_id,LyricsDrake,3TVXtAsR1Inumwj472S9r4,Free Smoke,05KOgYg8PGeJyyWBPi5ja8, Is it the strength of your feelings Overthrowing your pain Using you high to be reaching And is it today that you will find your new release And in your wake ripple your sweet voice And more chune for your head tops So watch how you speak on my name you know Yeah I could nt get a bill paid You could nt buy the real thing I was stayin up at yo place Tryin to figure out the whole thing I saw people doin things Almost gave up on the music thing But we all so spoiled now More life more everything Must have never had your phone tapped All that yappin on the phone shit You must really love the road life All that never comin home shit Free smoke free smoke aye Free smoke free smoke aye Free smoke free smoke aye Dom Ros toast Hidden Hills where I post I start my day slow Silk pajamas when I wake though Miraval to the face though I drunk text JLo Old number so it bounce back Boi1da got the bounce back Used to get paid for shows and frontdoor money Five ten twenties hand sanitize after you count that Me and Gibbo was about that Eatin Applebee s and Outback Southwest no first class Hilton rooms got ta double up Writin our name on a double cup We ai nt even have a tour bus Girls would nt even think of recordin me I fall asleep in sororities I had some different priorities Weezy had all the authority Women I like was ignorin me Now they like Are nt you adorable I know the question rhetorical I took the team plane from Oracle Mama never used to cook much Used to chef KD Now me and Chef KD Bet on shots for twenty Gs I brought the game to its knees I make too much these days to ever say Poor me Where you at I never see you Free smoke free smoke aye Free smoke free smoke aye Free smoke free smoke aye Niggas moves so waste Please come outside the house and show yourself So I can say it to your face It s bound to happen man it s got ta happen now So let s just get it out the way Lot of niggas goin bad on me Please one at a time I wan na move to Dubai So I do nt never have to kick it with none of you guys I did nt listen to Hov on that old song When he told me pay it no mind I get more satisfaction outta goin at your head And seein all of you die And I seen a lot of you die Free smoke free smoke aye Free smoke free smoke aye Free smoke free smoke aye Hidden Hills where I post yeah Ye already know yeah I m the troublemaker in the neighborhood Far as troublemakin goes yeah House party up the road yeah I m not Kid n Play This kid does nt play about the flow yeah Yall keep playin with your nose yeah You get high and do the most yeah How you let the kid fightin Ghostwritin rumors turn you to a ghost Oh you niggas got jokes Free smoke free smoke Baka Yeah we outchea Ya don know aye It s a OVO ting aye Ya don know aye It s a East Side ting aye Ya don know aye More life
Drake,3TVXtAsR1Inumwj472S9r4,No Long Talk,6CfrYuD3YRDYdYvH9jNtXY, Wheel it Yeah Six Yeah Murda on tha beat so it s not nice That s Baka he s a nolongtalker Quick to let a motherfuckin TEC slam We do nt need to hear about a next man Yutes talk down then they get ran Left them get dipped from the whole ends If Gilla call shots no questions GWay till I m restin But we still got love for the West End If it s a chitchat ting better talk nice Murda on the beat so it s not nice Skull gets hot then I m not nice You tryna date her and she been let me wap twice Now you man are on a diss ting Just know man like Chubbs He s a fixer if I ever got ta fix tings Just know man like Fif he s a sickaz You get tanned he do nt miss things Just know man like me I m a Sixer And I oversee the whole thing Yeah I pree the whole thing Yeah I pree the whole thing Preme got the hurt tucked ca nt see the whole thing Niggas wan na talk splits now we need the whole thing Man gets duppied when we touch a button Man catch suckers then we re touchin somethin Man gets stuck in yeah we re stuck in somethin Man gets rappin when we re suckin somethin Man gets battered with the crutch or somethin Man bat bat it then we buck or somethin If man child play it then we Chucky somethin If man start throwin then we re chuckin somethin I m on the best side got the TEC lined In the whip on the left side on a death ride MAC10 and the spesh flies and the TEC slide Nutty shit like somethin just climbed out the XFiles Textbook like it s old school like in textiles Lighty lookin healthy and she gets smiles Home time grab a quick drink and she gets wild Sexy and I rate that and her sex style Fuckin somethin yeah nigga fuckin somethin Back bent pussy I ll fuck her somethin Cognac better grab a cup of somethin Glue pussy like a nigga stuck or somethin Stuck or somethin like a nigga stuck or somethin Saw the monster it s like a truck or somethin Spread the pussy out I m bout to butter somethin Man gone Hollywood it s like I m Buck or somethin You dun know it s Hollowman Giggs Right now just here with the big man Drizzy you get me More Life flex you dun know OVO and SN1 to the world brap
Drake,3TVXtAsR1Inumwj472S9r4,Passionfruit,5mCPDVBb16L4XQwDdbRUpz, Hold on hold on fuck that Fuck that shit Hold on I got to start this mothafuckin record over again wait a minute Fuck that shit Still on this mothafuckin record Ima play this mothafucka for yall Ay yall get some more drinks goin on I ll sound a whole lot better Listen seeing you got ritualistic Cleansin my soul of addiction for now Cause I m fallin apart yeah Tension between us just like picket fences You got issues that I wo nt mention for now Cause we re fallin apart Passionate from miles away Passive with the things you say Passin up on my old ways I ca nt blame you no no Passionate from miles away Passive with the things you say Passin up on my old ways I ca nt blame you no no Listen hard at buildin trust from a distance I think we should rule out commitment for now Cause we re fallin apart Leavin you re just doing that to get even Do nt pick up the pieces just leave it for now They keep fallin apart Passionate from miles away Passive with the things you say Passin up on my old ways I ca nt blame you no no Passionate from miles away Passive with the things you say Passin up on my old ways I ca nt blame you no no Trying to think of the right thing to say
Drake,3TVXtAsR1Inumwj472S9r4,Jorja Interlude,13e6f8t7RKXuxZ0JdaaJRG, When you see them fall down but you pick em up You still let them touch the ground Do nt worry I swear They ll know you re trying to help em Tryna stay light on my toes Just ran a light in a Rolls Told me I m lookin exhausted You hit it right on the nose I m tired of all of these niggas I m tired of all of these hoes Worried bout takin my lane They ai nt even got on the road They turn they back and they leave you They gon be back when they need you I practice good over evil Flippin the script like a readthrough Yeah all of my brothers we equal I play my part too like a sequel You tell your niggas you got em on anything Question is do they believe you Specially when you never come through So much hate inside your heart We do nt even know what we done to you We just know shit gettin run through Never chase it let it come to you You out here tellin everybody everything You niggas move like the onetwo yeah When you see them fall down but you pick em up You still let them touch the ground Do nt worry I swear They ll know you re trying to help em They ll know you re trying to help em They ll know you re trying to help em They ll know you re trying to help em They ll know they ll know And more chune for your headtop So watch how you speak on my name you know
Drake,3TVXtAsR1Inumwj472S9r4,Get It Together,7y6c07pgjZvtHI9kuMVqk1, Hello I ve been hurt so many times It got to a point When I decided I ca nt do this anymore I need someone to hold me I need someone that needs me I need someone that loves me You need me to get that shit together So we can get together You need me to get that shit together So we can get together You need me to You need me to You know we do nt have to be dramatic Just romantic Do all the little things little things little things That excites me As your woman Give me a kiss goodnight Over the phone When you re working late When you re out of town Tell me how much you need this Cause we deserve it We can be together You need me to get that shit together So we can get together You need me to get that shit together So we can get together You need me to Yeah ohoh yeah You need me to Yeah You need me to Dun know already cause
Drake,3TVXtAsR1Inumwj472S9r4,Madiba Riddim,76gUmNLXGQVOsGhfcshkFP, I can not tell who is my friend I need distance between me and them Gon na have to teach me how to love you again God knows I m trying God knows I m trying for you God knows I m trying God knows it Pure mind and pure soul I possess he knows it Anointed and protected I was chosen My heart is way too frozen to get broken I seen man turn fool for the money One too many times I seen some girls turn they back On they best friend from time I heard you say things that you ca nt take back girl no time I need you to go easy now and fix up one time I can not tell who is my friend I need distance between me and them Gon na have to teach me how to love you again God knows I m trying God knows I m trying for you God knows I m trying People change I m not surprised Devil s working overtime Voodoo spells put on my life It wo nt work they all have tried I seen man turn fool for the money One too many times I seen some girls turn they back On they best friend from time I heard you say things that you ca nt take back girl no time I need you to go easy now and fix up one time I can not tell who is my friend I need distance between me and them Gon na have to teach me how to love you again God knows I m trying God knows I m trying for you God knows I m trying You put food on the table for me aye Alright fam soft I see you aye You pay my bills right It s light You re a wasteman Top story Wah
Drake,3TVXtAsR1Inumwj472S9r4,Blem,2XlHu0HcujBCkWMdIAvrqt, Unruly unruly maddas Who keeps bringing more I ve had too many This Virginia done me off already I m blem for real I might just say how I feel I m blem for real I might just say how I feel Do nt switch on me I got big plans We need to forward to the islands And get you gold no spray tans I need you to stop runnin back to your ex he s a wasteman I wan na know how come we can never splash and stay friends I m blem for real I might just say how I feel I m blem for real I might just say how I feel Cause I know what I like I know how I wan na live my life I do nt need no advice You re not here and we both know why So move from me when you re extra Move from me with the passa I m buildin up a house where they raised me You move with me I ll go crazy Do nt switch on me I got big plans We need to fall off to the islands And get you gold no spray tans I need you to stop runnin back to your ex he s a wasteman I wan na know how come we can never splash and stay friends I m blem for real I might just say how I feel I m blem for real I might just say how I feel I know we ca nt keep it together forever Cause you re crazy sometimes And I only see you sometimes Move from me when you re extra Move from me with the passa I m buildin up a house where they raised me You move with me I ll go look Do nt switch on me I got big plans We need to fall off to the islands And get you gold no spray tans I need you to stop runnin back to your ex he s a wasteman I wan na know how come we can never splash and stay friends I m blem for real I might just say how I feel I m blem for real I might just say how I feel Together forever Good morning Good afternoon Good night I m here to talk about More Life One second
Drake,3TVXtAsR1Inumwj472S9r4,4422,2fkeWbM6iqTw7oGHTYm2lw, I m runnin but ca nt run away You say you changed but you never change up 44 22 You build it up to break it halfway through Just make the call 22 But you re just the same as I ever knew 44 22 You build it up to break it halfway through Just make the call 22 But you re just the same as I ever knew 44 22 You build it up to break it halfway through Just make the call 22 But you re just the same as I ever knew 44 22 You build it up to break it halfway through Just make the call 22 But you re just the same as I ever knew 44 22 You build it up to break it halfway through Just make the call 22 But you re just the same as I ever knew I know I fear trust I know I fear fear too much On my plate lookin up Outer space Pearly Gates I m runnin but ca nt run away You say you changed but you never change up
Drake,3TVXtAsR1Inumwj472S9r4,Gyalchester,6UjfByV1lDLW0SOVQA4NAi, Herms link iceblue mink Tat on my ribs like I do not know what permanent is They want me gone wait for the kicker Bury me now and I only get bigger That s word to my nigga Yeah October Firm in the cut Stay at the top like I m stuck That s just how I m givin it up She wan na get married tonight But I ca nt take a knee cause I m wearin all white Me and my broski are twins but we do nt look alike I do nt take naps Me and the money are way too attached to go and do that Muscle relax That and the spliff put me right on my back I got ta unpack Virginia Black I could go make enough money off that and not even rap What s that Facts Contract max I got ta bring that shit back Herms link iceblue mink Tat on my ribs like I do not know what permanent is They want me gone out of the picture Bury me now and I only get bigger That s word to my word to my I m so hot yeah I m so right now Who s not gang bitch Let me find out Keep hearin clicks when I m talkin on the iPhone Feds in the city hate to see us on a high note I switch flow like I switch time zone Ca nt get Nobu but you can get Milestone I got ta do mansion cause I outgrew condo Got ta do Maybach she wan na fuck on the drive home Yeah met her once and I got through I m never washed but I m not new I know I said top five but I m top two And I m not two and I got one Thought you had one but it s not one nigga nah Herms link iceblue mink Tat on my ribs like I do not know what permanent is They want me gone wait for the kicker Bury me now and I only get bigger That s word to my nigga
Drake,3TVXtAsR1Inumwj472S9r4,Skepta Interlude,2dfqS3MRtbLZSZA1IL8xY5, It s a madness Check my account it s a madness Mmm Block that account it s a catfish Yeah Block that account it s a catfish Dubplate special Check my account that s a madness Check my account that s a madness OVO BBK Block that account that s a catfish Block that account that s a catfish You do nt know me You better get to know me Stand up tall right next to Kobe A young G I had the weapon on me Slice up work like pepperoni shing The police still arrest the homies No statement no testimony Spit in your face with extra bogey It s my time I do nt flex a Rollie On cloud 9 a man s extra cosy greaze I might switch it up and direct a movie Pussyholes tried to execute me Died and came back as Fela Kuti Do nt phone me send a text to Julie OVO man s so unruly South by ride out no Suzuki Got the Austin Powers a man s extra groovy greaze Front row jacket tailormade Crackhead swag with the razor blade Red umbrella when I make it rain My whole team winnin we do nt play your game Sound like me but they ai nt the same See them online tryna fake the fame They wan na bust jokes they think I m Damon Wayans It s a madness Check my account it s a madness More Life Block that account it s a catfish Block that account it s a catfish OVO BBK Check my account that s a madness dubplate Check my account that s a madness street team Block that account it s a catfish Block that account it s a catfish Yeah they re nothin like me I m a fuckin villain Go against me that s a tough decision Police wish I was stuck in prison Fisheye lens on my tunnel vision straight Real life greaze when I touch the riddim Still the same guy when I touched a million Record labels wanted us to listen But it s greatness only for the love of Britain I say it how it is and no fucks are given Greaze so do nt forget to remember me Especially all my enemies Keep your eyes on me with your jealousy The most solid gang that you will ever see Just came back from the embassy Check my crime sheet check my legacy And now I m back on tour so what you tellin me Greaze Taliban Halloween Pull up in the whip with the gasoline Yeah that s that boy from the magazine Bust my dance at the cash machine Make her back it up bounce on my trampoline Like Martin Luther man I had a dream Now it s my world you can have the scene It s a madness Check my account it s a madness Block that account it s a catfish Block that account it s a catfish Check my account that s a madness Check my account that s a madness Block that account it s a catfish Block that account it s a catfish
Drake,3TVXtAsR1Inumwj472S9r4,Portland,2bjwRfXMk4uRgOD9IBYl9h, Murda on the beat so it s not nice Yeah It s all Habibis ting ya Yeah my side girl got a 5S with the screen cracked Still hit me back right away better not never hesitate Do nt come around thinkin you gettin saved Tryna show the dogs brighter days Got a torch tryna light the way Bitin everybody which is ironic cause your next album probably wo nt ever see the light of day Have fans but you let em down But I guess that s how you niggas gettin down I m so high up I m like How is niggas really gettin down I could never have a kid then be out here still kiddin around Boys playin around where you really wan na take it now I got a hundred fifty thousand dollars for an after party And I gave it to the killas just to break it down Bring us up I never take us down But if you bring me up then they might take you down Fake fuck with me back then But it s gettin hard for you to fake it now Fuck bein rich when I m forty man I m tryna make it now Hell nah Never let these niggas ride your wave Nope no way nah Never let these niggas ride your wave Nope no way nah Park the Benz just to the ride the Wraith Skrrt skrrt Ten million dollars got ta hide the safe Skrrt skrrt oh Michael Phelps with the swim moves Skrrt skrrt oh Michael Jordan with the tennis shoes Skrrt skrrt Quavo Young nigga I invented you Ike Turner with the left hand Griselda Blanco with the trap moves Gangland with the right hand Undertaker with the tattoos Never listen to the class rules Switch it up would be the last move Let s go I m a magnet for bad bitches magnet You got the going out sad bitches I spent a fifty on the chain racks You spent your last fifty ugh cash I got the keys to the streets keys You got the key to defeat defeated I got the keys to the warzone brrrapt You got the key to the bees ugh Hell nah Never let these niggas ride your wave Nope no way nah Never let these niggas ride your wave Nope no way nah Park the Benz just to ride the Wraith Skrrt skrrt Ten million dollars got ta hide the safe We gon go live we gon go live yep We gon go live we gon go live yep Gettin loose off the Henny rock and a hint of Goose Ocean deep in my swimmin pool Throwin Dead Prez in my livin room Takin shots feelin bulletproof Flood my rollie told my bitch Let s go snorkelin Out in Portland tryna get in her organs No I did not sign with Jay but I still send a Tidal wave Yeah I might just go get the fade Buy the durag and just tie the waves It s lit at the crib you could stay Me and Drake kick like Kid N Play The way that she servin that cake I got ta sit back and digest I guess fuck the fuckshit I m biased I mix double the cup when I m stressed Got my momma out the basement That s a different type of face lift Free Max B out the bracelets Do nt hit us askin what the wave is Hell nah Never let these niggas ride your wave Nope no way nah Never let these niggas ride your wave Nope no way nah Park the Benz just to the ride the Wraith Skrrt skrrt Ten million dollars got ta hide the safe Skrrt skrrt oh Michael Phelps with the swim moves Skrrt skrrt oh Michael Jordan with the tennis shoes Skrrt skrrt oh Michael Phelps with the swim moves Skrrt skrrt oh Michael Jordan with the tennis shoes
Drake,3TVXtAsR1Inumwj472S9r4,Sacrifices,0xl1w2q4VLojeXp4JfazPL, Wrote this shit January 21 Baby girl I had to run I ll be back a couple months Kendall turned 21 was up the street with 21 They could see me online but they wo nt see me on the ones I got Dubai plates in the California state I got her waitin at my place I got no baby on the way I m talkin Baby like Stunna I m talkin Baby like Face Lost millions in the past I m talkin maybe like eight Couple niggas from the city Wishin on a star could they be like Drake Sorry no not today you got ta find your own way Big dog from the 6 I m talkin Dogg like Nate My shit be raw out the gate I do nt need another take 40 got house on the lake I ai nt know we had a lake She complainin how I m late I ai nt know it was a date Niggas see me in person First thing they say is I know you need a break Hell naw I feel great ready now why wait Like a kiss from a rose I could be the one to seal your whole fate So be careful what you think think about what you gon say Got ta deal with people straight I got my 23 s laced It s a marathon not a sprint but I still got ta win the race yeah And I m convinced I made sacrifices I been ballin ever since We seein so many blessings shit do nt make no sense Someone watchin over us so shout goes out to Him Yeah I m convinced I made sacrifices I been ballin ever since Yeah I did some wrong I had no choice in my defense Someone watchin over us so shout goes out to 2 Chainz I m a real one Few shows that s a mil run When she bust it down I said Thanks for givin to me like a pilgrim Cold world ll be chillin Earmuffs on the children Used to trap out the Hilton Got wood on the Cartiers that s a face full of splinters Count a bankroll for dinner This the wrong place to enter Phone sex for breakfast all kinda women text us Met her at the Super Bowl Told her I stayed down the street from Texas ATown I stay down yeah it s all in the wrist This one here out the fence Trap jumpin like the Carter Mean it jumpin like Vince Moved on from the election Introduced her to the plug Ca nt believe they tried to take the connection Ooh girl you a blessin fine ass be finessin Yeah I love my fans But I do nt wan na take pictures in the restroom Drench God with the 6 God point guard and the two guard Pretty Girls Like Trap Music So I woke up with my wood hard And I m convinced I made sacrifices I been ballin ever since We seein so many blessings shit do nt make no sense Someone watchin over us so shout goes out to Him Yeah I m convinced I made sacrifices I been ballin ever since Yeah I did some wrong I had no choice in my defense Someone watchin over us so shout goes out to I was stealin from a bitch slime Back when I was 21 facts My favorite gun was a SIG nine 20 in the clip head one no cockin Growin up I was a runnin back You never made me ran once I got shot sweat started runnin goddamn That shit was red like Hunt ketchup I m kickin pimpin like I punt beat it But do nt you think shit s sweet I m talkin sweet deer meat ooh I m talkin suite like he sleep like he sleep We ai nt doin too much talkin I m talmbout talkin like a speech election Like the President I kill em neat scammers I m talkin neat like freak I m talkin neat like fleek I m talkin neat like a geek You come with beef I eat the beat I m talkin B s spellin bee sheesh Double R that s a Rolls paint it yellow like it s dairy I m talkin Rose like Derrick I m talkin rolls like a belly wooh Like a new car I got two keys Tryna score the bucket like a Chevy seat Then I heard they been pullin all week I m a use ya name like Who is he You get it I said Ima username like Who is he Got some gold on leprechaun sheesh Deep sleep short for deceased Big bezel on the Patty wooh I m talkin PADII meant Patek Do nt try to take it I got guns I m talkin guns not pellets I watch the game from the floor floor seats I m talkin wood first mattress I m talkin wood pants down I m talkin woods like them clowns you get it I got my mink off a monkey I m talkin monkey like Jumanji hrr All your diamonds partly sunny I m talkin sunny like D Sunny Sunny Delight My diamonds wet it cost me money I m talkin wet like it s runnin sink I m talkin wet like Katrina New Orleans I m talkin wet like Dasani huh And I m convinced I made sacrifices I been ballin ever since We seein so many blessings shit do nt make no sense Someone watchin over us so shout goes out to Him Yeah I m convinced I made sacrifices I been ballin ever since Yeah I did some wrong I had no choice in my defense Someone watchin over us so shout goes out to
Drake,3TVXtAsR1Inumwj472S9r4,Nothings Into Somethings,6MbH1QiphMCPTqVEVC7UYi, You ever hear some slow tracks you know what I m sayin With like some pimpin to it or somethin That you can relax pop a top to or somethin Big cup of Ac I m drowsy I m still posted up where you first found me Did I just read that you just got engaged on me I heard from your friend you could nt even tell me Or better yet wait on me Nah shanahnahnahnahnah Shanahnahnahnahnah Ca nt just leave it off that way Shanahnahnahnahnah Shanahnahnah Ca nt just leave it off that way nah Least do I get an invitation or something A statement or something Ask about that you would say it was nothing But here s another nothing that you made into something Ca nt just leave it off that way
