Artist,Artist_id,Song,Song_id,LyricsPost Malone,246dkjvS1zLTtiykXe5h60,Otherside,4qWCFTuNnmGNdY4egtb4ZY, I been waitin wide awake for the waves to come and take Take me right to you One hundred bottles of the good shit could nt even bring you back What am I to do Feel like I m circlin a drain all I see is the remains of an ugly truth One hundred models I could follow all the way to hell and back but they ca nt replace you Oh oh oh oh Oh oh oh oh Oh oh oh oh oh Oh oh oh oh Oh oh oh oh Oh oh oh oh Oh oh oh oh oh I was puttin on for you like a jersey What I did nt know then could nt hurt me Never thought you were gon na do me dirty Left me in the cold but on the inside I was burnin But that s just the way it goes Wish that I could have control Everybody dies alone And I ai nt dead yet Save my breath but I lost faith a long time ago Dream nightmares I guess we re gettin used to losin hope I do nt even wonder why you do nt answer when I call your name Are you on the other side Will you save us Or will you run away I m still waitin wide awake for the waves to come and take Take me right to you take me right to you One hundred vials of denial I know they wo nt bring you back What am I to do What am I to do You re my alibi and motive when I m lyin to myself of the ugly truth what an ungly truth We re no strangers to the flame We will never be the same if we make it through and we can make it through My back is up against the wall But I used to feel invincible Yeah it was us against the world But somehow someway the take was comin I remember back then Played my cards right you were my best hand Still you keep me guessin Wonder if I ll ever get the message Save my breath but I lost faith a long time ago Dream nightmares I guess we re gettin used to losin hope I do nt even wan na know why you do nt answer when I call your name Are you on the other side Will you save us Or will you run away Are you on the other side Will you save us Or will you run away
Post Malone,246dkjvS1zLTtiykXe5h60,Stay,4H7WNRErSbONkM06blBoGc, It s true that all that you know is all that you are You said that it s all that you want and more Fuck off and pour another drink And tell me what you think You know that I m too drunk to talk right now You put your cigarette out on my face So beautiful please woman Do nt break your back for me I ll put you out of your misery Tell me that it s all okay tell me that it s all okay I ve been waitin on this all damn day waitin on this all damn day Call me in the mornin tell me how last night went I m here but do nt count on me to Stay a little longer if you convince me And tell me all the things that you have against me Every time we make up the truth is fadin Everybody s blind when the view s amazin Damn who are we right now Can we have a little conversation Figure it out with no intoxication We carry on what is our motivation We re never wrong how the hell we gon na make it Maybe we re used to this Tell me what are we to do It s like we only play to lose Chasin pain with an excuse I love that shit and so do you But do nt break your back for me I ll put you out of your misery Tell me that it s all okay tell me that it s all okay I ve been waitin on this all damn day waitin on this all damn day Call me in the mornin tell me how last night went I m here but do nt count on me to stay Tell me that it s all okay tell me that it s all okay I ve been waitin on this all damn day waitin on this all damn day Call me in the mornin tell me how last night went I m here but do nt count on me to stay
Post Malone,246dkjvS1zLTtiykXe5h60,Blame It On Me,1ZemPoaj7LBj1RAQrb89EC, I used to say I was free Now all these people wan na keep on takin pieces of me They take away everything had everything that I needed They held me down let me drown They spit me out right through the teeth I ca nt pretend ash in the wind wo nt blow again It was a breeze for you These hurricanes inside of my brain let it rain made it look easy Ca nt look away you love the pain you love the pain Watchin me bleed You cut me down on my knees No matter what you believe I think we both can agree That you ca nt blame it on me yeah It s not my fault it s not my fault it s not my fault Blame it on me It s not my fault it s not my fault it s not my fault I could nt breathe Almost lost myself could nt stop myself I did it all You ca nt blame it on me It s not my fault it s not my fault it s not my fault Everyday s the same yeah I just watch em go As I scrape away through the impossible Yeah I played the game but it was all for show Tryna find my way I nearly lost it though Now I see dead people most have no faith Where did the time go A watch with no face They hit the ceilin but my roof likes space I took my chances so wo nt you Blame it on me It s not my fault it s not my fault it s not my fault Blame it on me ay It s not my fault it s not my fault it s not my fault I could nt breathe Almost lost myself could nt stop myself I did it all You ca nt blame it on me It s not my fault it s not my fault it s not my fault not my fault It s all my fault that I m addicted to the clothes It s all my fault I paid the cost yeah It s all my fault that I ai nt givin up my soul It s all my fault Watchin me bleed You cut me down on my knees No matter what you believe I think we both can agree That you ca nt blame it on me It s not my fault it s not my fault it s not my fault Blame it on me It s not my fault it s not my fault it s not my fault I could nt breathe Almost lost myself could nt stop myself I did it all You ca nt blame it on me ay It s not my fault it s not my fault it s not my fault It s not my fault it s not my fault it s not my fault Blame it on me yeah It s not my fault it s not my fault it s not my fault
Post Malone,246dkjvS1zLTtiykXe5h60,Same Bitches (feat. G-Eazy & YG),688QpQAwqsLdBR6lr13wK1, I been in LA too long How I see the same bitches everywhere I go It do nt really matter where they from Actin or a model heard it all before Population four million how I see the same bitches Yeah yeah Population four million how I see the same bitches Yeah yeah yeah I hit your DM baby Took the screenshot yeah you tried to play me I bet this shit was good for your reputation I just let it go so I could see you naked Holy moly look at what you rolled in Million followers but your bumpers broken What s your focus Tell me what your goal is I know you only like me cause I just spent a hundred bands in one night Spent a hundred bands in one night I know you wan na live this life But I ca nt make a ho a housewife oh no What s your name Who s your daddy Is he rich like me Is he rich like me Yeah yeah yeah I been in LA too long How I see the same bitches everywhere I go It do nt really matter where they from Actin or a model heard it all before Population four million how I see the same bitches uh yeah Yeah yeah Population four million how I see the same bitches Gerald Yeah yeah yeah uh Everywhere I go I see the same ho Always post selfies on the Gram from a angle a Catfish Hollywood devil not a angel Her bag is Chanel but she drive a Durango Yeah and I m gettin to the queso Woke and I m hip to the game so I m thankful OGs put me on tours so I m laced bro Real recognizin that you do nt speak the lingo Clothes all new not a wrinkle Givin you the game gettin sprinkled Bottles on deck and my drink full I turn to a beast I m a dog I m a pitbull This life did it to me I ca nt switch back If I take her then you ll never get your bitch back Yeah the beat knockin yeah this shit clap Welcome to the west it s where people gettin rich at ay I been in LA too long G How I see the same bitches everywhere I go It s Eazy you know It do nt really matter where they from yee yee yee Actin or a model heard it all before ay Population four million how I see the same bitches west side nigga how Population four million how I see the same bitches hol up let me talk my shit hol up Yeah yeah yeah I been in LA too long Me and my bros hit the same hoes LA Hollywood that s some Valley hoes Do I know how to fuck They all know Yeah yeah fuck it go down baby you ratchet I m with the program baby yeah Word in the streets you with the whole town baby I m tryna do it for the brother like Motown baby for the record She fucked the LA Laker for the record She fucked a Dodger baseball player for the record She fucked the head of my record label ooh How you think she been so stable Ah damn ah damn but she down to fuck Designer everything Benz Truck Pullin up with you friend tell me who she is Oh never mind my friend fucked Population four million how I see the same bitches haha never mind my friend fucked Population four million how I see the same bitches haha never mind my friend fucked Population four million how I see the same bitches I see the same bitch Yeah yeah yeah Population four million how I see the same bitches I see the same bitch
Post Malone,246dkjvS1zLTtiykXe5h60,92 Explorer,1D2L6MefbXon28PzIk9I3r, Oh yeah yeah wow yeah yeah yeah yeah We got London On Da Track Hunnid and twenty come catch me Forties inside of my belly Should nt be drivin I m faded skrt yeah yeah Rock that Nirvana my favorite Damn I forgot what her name is She in the front seat head bangin yeah yeah yeah Money counter sound somethin like a chopper chopper Speakers system bumpin fuck your fuckin block up Used to mock him now his cars some Bentley mockups Killer drop a call from lockup If you buy that Echo why you lyin You broke Got a nine in my tote get you smoke like a stove Keep on ridin my coat your new shit is a joke Why you bitin my flows What you tryna be Post Ooh baby ooh baby go on keep it spinnin Ooh yuck me up I do nt want no romancin Ooh baby I see these muhfuckas glancin When my whip stop then my wheels keep spinnin Ooh baby ooh baby go on keep it spinnin Ooh yuck me up I do nt want no romancin Ooh baby I see these muhfuckas glancin When my whip stop then my wheels keep spinnin She used to shoppin at the mall ooh I ll teach lil baby how to ball I hit Rodeo spent like 40 G s wow Four hunnid pairs of Gucci socks I lost all my friends made a lot of foes Made a lot of M s made a lot of Os Open up the safe I m just with the bros Cop the 458 cost me 250 Man look at all my ice ice I hit your main thing twice your main thing twice Take a word of advice a word of advice Break up with that ho ho Ooh baby ooh baby go on keep it spinnin Ooh yuck me up I do nt want no romancin Ooh baby I see these muhfuckas glancin When my whip stop then my wheels keep spinnin Ooh baby ooh baby go on keep it spinnin Ooh yuck me up I do nt want no romancin Ooh baby I see these muhfuckas glancin When my whip stop then my wheels keep spinnin Cold wrist frozen Got sacks Goldman Bought the bar Roseanne No joke they ai nt playin Ooh baby ooh baby go on keep it spinnin Ooh yuck me up I do nt want no romancin Ooh baby I see these muhfuckas glancin When my whip stop then my wheels keep spinnin Ooh baby ooh baby go on keep it spinnin Ooh yuck me up I do nt want no romancin Ooh baby I see these muhfuckas glancin When my whip stop then my wheels keep spinnin Yeah We got London On Da Track
Post Malone,246dkjvS1zLTtiykXe5h60,Candy Paint,32lItqlMi4LBhb4k0BaSaC, Yeah yeah mmm Candy paint with the white on top Lambo doors are the oohop drop If you busy plotting on what I got Kick in your door that s SWAT you thought Hundred thousand dollars on the table top Half price my whip same price my watch Got no jumper but I ball a lot Bitch I m young Stoney I do what I want Candy paint with the white on top skrrt Lambo doors are the oohop drop drop If you busy plotting on what I got Kick in your door that s SWAT you thought pop Hundred thousand dollars on the table top Half price my whip same price my watch bling Got no jumper but I ball a lot swish Bitch I m young Stoney I do what I want Did nt know that was your girl when she gave me top yuh Kicked her out the Rolls said Thanks a lot Goddamn I love paper like I m Michael Scott yeah I can do things that your man can not yeah Slide boy comin down damn I m hot hot Everybody say that I got ta be stopped stopped Even though my final form ai nt unlocked locked I m so ahead of you motherfuckers How you comprehend what you ai nt understanding Count a hundred bands and I watch it vanish Diamonds going crazy like they on the dance floor Got a lot of ass nothing I ca nt handle Flavor lasts forever you should try a sample God damn Baby I m the boss like I m Tony Danza Tony Danza Everybody trying to tell me what I stand for But you do nt fucking know me homie you do nt want war aye Candy paint with the white on top Lambo doors are the oohop drop If you busy plotting on what I got Kick in your door that s SWAT you thought Hundred thousand dollars on the table top Half price my whip same price my watch Got no jumper but I ball a lot hey hey Bitch I m young Stoney I do what I want hey hey Candy paint with the white on top yeah Lambo doors are the oohop drop drop drop If you busy plotting on what I got Kick in your door that s SWAT you thought pop pop pop pop Hundred thousand dollars on the table top Half price my whip same price my watch yeah Got no jumper but I ball a lot swish Bitch I m young Stoney I do what I want I ve been rolling twenty ash hit the road wooh Hit the switch up the suicide doors damn We already know you vanished though ooh Hit my momma when I ride in that oh All these motherfuckers so false with me yah If your money funny do nt talk to me nah I know there ai nt shit that you could offer me no Take a second if you think about crossing me It lasts forever you should try a sample God damn Baby I m the boss like I m Tony Danza Tony Danza Everybody trying to tell me what I stand for what I stand for But you do nt fucking know me homie you do nt want war you do nt want war Candy paint with the white on top Lambo doors are the oohop drop If you busy plotting on what I got Kick in your door that s SWAT you thought Hundred thousand dollars on the table top Half price my whip same price my watch Got no jumper but I ball a lot Bitch I m young Stoney I do what I want Candy paint with the white on top Lambo doors are the oohop drop If you busy plotting on what I got Kick in your door that s SWAT you thought Hundred thousand dollars on the table top Half price my whip same price my watch Got no jumper but I ball a lot Bitch I m young Stoney I do what I want
Post Malone,246dkjvS1zLTtiykXe5h60,Sugar Wraith,0MrRAUcB8AZiB9ue2VOBYe, I started with an eighth alright alright And then I went and changed my life my life I might take out the Wraith tonight tonight Put your arms around me baby I just want to fly make it last before we die And I know you want a ride What s on your mind What s on your mind And my 92 got doors like my Lambo Spend my last paycheck on some ammo We do nt follow trends rest in peace to Yamo Your new shit sucks I feel like Anthony Fantano Sayin I was broke last year I ca nt go back there Nicotine fiend could nt even buy a pack yeah She do nt know my music told her I ai nt mad yeah Let her cut that coco on my platinum plaque yeah wow Cut my fingers on my bands oh yeah Cut my locker with some Xan oh yeah Count me my guala in advance oh yeah Backstreet diamonds watch them dance on ya yeah I started with an eighth alright alright And then I went and changed my life my life I might take out the Wraith tonight tonight Put your arms around me baby I just want to fly make it last before we die And I know you want a ride What s on your mind What s on your mind She do nt want to spend all my dough She gets paid to be a model I take the lead they just follow Face it you do nt know what I know Pull up I got some for ya Somethin in my trunk for ya But I got a good lawyer They always try to come for ya Ima pull up in that Bentley with the fuckin windows tinted Dependin how I m feelin take a drop of the extended Think I m showin signs of slowin homie just forget it I guess this what happens when you fuckin handle business yeah I started with an eighth alright alright And then I went and changed my life my life I might take out the Wraith tonight tonight Put your arms around me baby I just want to fly make it last before we die And I know you want a ride What s on your mind What s on your mind I was broke last year I ca nt go back there I was broke last year I ca nt go back there Got some lean and I went a little mad yeah Try to take the swagger I know it for a fact Ima pull up in that Bentley with the fuckin windows tinted Dependin how I m feelin take a drop of the extended Think I m showin signs of slowin homie just forget it I guess this what happens when you fuckin handle business yeah I started with an eighth alright alright And then I went and changed my life my life I might take out the Wraith tonight tonight Put your arms around me baby I just want to fly make it last before we die And I know you want a ride What s on your mind What s on your mind
