Artist,Artist_id,Song,Song_id,Lyrics
Drake,3TVXtAsR1Inumwj472S9r4,Survival,2yg9UN4eo5eMVJ7OB4RWj3, I been waitin on this Yeah All of this disorder no addressin The crown is broken in pieces but there s more in my possession There s a whole lot in my possession Who do you really love Well that s sure to be in question My Mount Rushmore is me with four different expressions Who s givin out this much return on investment After my run man how is that even a question After this summer man how is that even a I ve had real Philly niggas try to write my endin Takin shots with the goat and talked about shots that we sendin I ve had scuffles with Bad Boys that was nt pretendin I ve had too many nights to mention that s just the beginnin I m pretty sure we got a label I m still independent I fell back a hundred times when I do nt get the credit Seen this movie a hundred times I know where it s headed Realize someone got ta die when no one ll dead it Niggas gamblin with they life for some content That s the type of lottery that could get your top picked I am a creamofthecrop nigga You niggas pop mollies my Mali s pop niggas House on both coasts but I live on the charts I have tea with the stars and I swim with the sharks And I see in the dark was nt this cold at the start Think my soul has been marked there s a hole in my heart Yeah I was about to man I thought about it It s unsettlin to talk about it Free all of my niggas that they caught with it RIP my niggas that they caught without it This just the intro let me not get ahead of myself This is God s plan young man you said it yourself Always got a ace up my sleeve for whatever was dealt Daddy got suits like Bernie Mac he dresses himself I stopped askin myself and I started feelin myself Now I got ta deal with all this drama and deal with myself I ai nt even have to cut the tie it severed itself This just the intro let me not get ahead of myself
Drake,3TVXtAsR1Inumwj472S9r4,Nonstop,0TlLq3lA83rQOYtrqBqSct, Tay Keith fuck these niggas up Look I just flipped a switch flipped flipped I do nt know nobody else that s doin this Bodies start to drop ay hit the floor Now they wan na know me since I hit the top ay This a Rollie not a stopwatch shit do nt ever stop This the flow that got the block hot shit got super hot Give me my respect give me my respect I just took it left like I m ambidex Bitch I move through London with the eurostep Got a sneaker deal and I ai nt break a sweat Catch me cause I m goin outta there I m gone How I go from 6 to 23 like I m LeBron Servin up a pack servin up a pack Niggas pullin gimmicks cause they scared to rap Funny how they shook ay got these niggas shook Pullin back the curtain by myself take a look ay I m a bar spitta I m a hard hitta Yeah I m light skinned but I m still a dark nigga I m a wig splitta I m a tall figure I m a unforgivin wildass dog nigga Somethin wrong with em got em all bitter I m a bill printer I m a grave digger Yeah I am what I am I do nt have no time for no misunderstandings again This a Rollie not a stopwatch shit do nt ever stop Future took the business and ran it for me I let Ollie take the owl told him brand it for me I get 2 million a pop and that s standard for me Like I went blind dog you got ta hand it to me Got ta gim me that shit dog Prayed then I prayed again Amen Lord Had a moment but it came and went They do nt love you no more You do nt wan na play with him nah nah nah They ll be mournin you like 8AM RIP Pinky ring till I get a wedding ring whoa yeah Love my brothers cut em in on anything big slice And you know it s King Slime Drizzy damn She just said I m bae I hit the thizzle dance Mac Dre shit damn Either hand is the upper hand oh yeah shit Got a bubble on my other hand oh yeah shit yeah This shit ai nt no hundred bands nah nah nah nah Palace look like Buckingham Bills so big I call em Williams for real Reasons to go crazy got a trillion for real They been tryin me but I m resilient for real I ca nt go in public like civilian for real And I hardly take offense Money for revenge man that s hardly an expense Al Haymon checks off of all of my events I like all the profit man I hardly do percents I do nt do that shit A big part of me resents Niggas that I knew from when I started in this shit They see what I got and man it s hard to be content Fuck what they got goin on I got ta represent This a Rollie not a stopwatch shit do nt ever stop This the flow that got the block hot shit got super hot
Drake,3TVXtAsR1Inumwj472S9r4,Elevate,3szf2z1Cy1QMrtHrbn8rz9, Ay elevate elevate Only obligation is to tell it straight So much on my plate I got ta delegate Baka passed a drug test we got ta celebrate I m in better weight thinkin how d I make All this happen for myself and my family All this happen for myself and my family There s no way that this is real man it ca nt be Yeah yeah If you need me you ca nt call me I stay busy makin money You know what is on my mind All I think about is hunnids I stay busy bzz workin on me I stay busy with my business homie I already hit her when you left her lonely She is not the type that likes to take things slowly Slowly my mouth is goin off I do nt know patience I got a chance then my niggas got it too like it s contagious I see the future when I get wavy wavy God But I could nt picture bein Champagne when I would buy that shit and save it for the right occasion I could nt picture changes when I was with Ms Craten That lady hates me Could nt picture wifin Braden when I was pumpin gas on road trips to go from Cincinnati on to Dayton I could nt gauge it I wan na thank God for workin way harder than Satan He s playin favorites it feels amazin yeah Elevate elevate Only obligation is to tell it straight Me and all the guys found a better way This for life bih we can never separate I m in better weight thinkin how d I make All this happen for myself and my family All this happen for myself and my family There s no way that this is real man it ca nt be Yeah I can only tell you shit in pieces As it happens to me I begin to write the thesis Freddy got the Aria setup like it s a Freaknik Vegas like Marine Land that big whale treatment Georgie got me up a hunnid thousand for the weekend I got ta move the safe beside the bed when I be sleepin My mood is changin this summer Ima be tweakin
Drake,3TVXtAsR1Inumwj472S9r4,Emotionless,5Psnhdkyanjpgc2P8A5TSM, You ve got me feeling emotions Higher ooh You ve got me fe You ve oh Do nt link me Do nt hit me when you hear this and tell me your favorite song Do nt tell me how you knew it would be like this all along I know the truth is you wo nt love me until I m gone And even then the thing that comes after is movin on I ca nt even capture the feeling I had at first Meetin all my heroes like seein how magic works The people I look up to are goin from bad to worse Their actions out of character even when they rehearse Workin in the land of the free the home of the brave I got ta bring my brothers or else I feel out of place Breakin speed records on roads that these niggas paved And they do nt like that it s written all on they face I do nt know how Ima make it out of here clean Ca nt even keep track of who plays for the other team Iconic duos rip and split at the seams Goodhearted people are takin it to extremes Leavin me in limbo to question what I believe Leavin me to ask what s their motive in makin peace Leavin me to not trust anybody I meet Leavin me to ask is there anybody like me You ve got me fe You ve ohh You ve got me fe You ohh Aye Missin out on my years There s times when I wish I was where I was Back when I used to wish I was here Missin out on my days Scrollin through life and fishin for praise Opinions from total strangers take me out of my ways I m tryna see who s there on the other end of the shade Most times it s just somebody that s underage That s probably just alone and afraid And lashin out so that someone else can feel they pain I always hear people complain about the place that they live That all the people here fake and they got nothin to give Cause they been starin at somebody else s version of shit That makes another city seem more excitin than it is I know a girl whose one goal was to visit Rome Then she finally got to Rome And all she did was post pictures for people at home Cause all that mattered was impressin everybody she s known I know another girl that s cryin out for help But her latest caption is Leave me alone I know a girl happily married till she puts down her phone I know a girl that saves pictures from places she s flown To post later and make it look like she still on the go Look at the way we live I was nt hidin my kid from the world I was hidin the world from my kid From empty souls who just wake up and looked to debate Until you starin at your seed you can never relate Breakin news in my life I do nt run to the blogs The only ones I wan na tell are the ones I can call They always ask Why let the story run if it s false You know a wise man once said nothin at all I m exhausted and drained I ca nt even pretend All these people takin miles when you give em an inch All these followers but who gon follow me to the end I guess I ll make it to the end and Ima find out then You ve got me fe You ve ohh Aye Higher higher You ve got me fe You ve ohh Aye Higher higher
Drake,3TVXtAsR1Inumwj472S9r4,God's Plan,6DCZcSspjsKoFjzjrWoCdn, Yeah they wishin and wishin and wishin and wishin They wishin on me yo I been movin calm do nt start no trouble with me Tryna keep it peaceful is a struggle for me Do nt pull up at 6 AM and cuddle with me You know how I like it when you lovin on me I do nt wan na die for them to miss me Guess I see the things that they wishin on me Hope I got some brothers that outlive me They gon tell the story shit was different with me God s plan God s plan I hold back sometimes I wo nt yuh I feel good sometimes I do nt ay dont I finessed down Weston Road ay nessed Might go down a GOD yeah wait I go hard on Southside G yuh wait I make sure that northside eat And still Bad things It s a lot of bad things That they wishin and wishin and wishin and wishin They wishin on me Bad things It s a lot of bad things That they wishin and wishin and wishin and wishin They wishin on me Yuh ay ay She say Do you love me I tell her Only partly I only love my bed and my momma I m sorry Fifty dope I even got it tatted on me 81 they ll bring the crashers to the party And you know me Turn the O2 into the O3 dog Without 40 Oli there would be no me Imagine if I never met the broskies God s plan God s plan I ca nt do this on my own ay no ay Someone watchin this shit close yep close I ve been me since Scarlett Road ay road ay Might go down as GOD yeah wait I go hard on Southside G ay wait I make sure that northside eat yuh And still Bad things It s a lot of bad things That they wishin and wishin and wishin and wishin They wishin on me Yeah yeah Bad things It s a lot of bad things That they wishin and wishin and wishin and wishin They wishin on me Yeah
Drake,3TVXtAsR1Inumwj472S9r4,I'm Upset,3qN5qMTKyEEmiTZD38BNTT, Yeah I m workin on dyin I m upset Fifty thousand on my head it s disrespect So offended that I had to double check Ima always take the money over sex That s why they need me out the way What you expect Got a lot of blood and it s cold They keep tryna get me for my soul Thankful for the women that I know Ca nt go fiftyfifty with no ho Every month I m supposed to pay her bills And get her what she want I still got like seven years of doin what I want My dad still got child support from 1991 Outta time people love to pop a lot of shit then come around Word to Flacko Jodye he done seen us put it down Niggas askin if I m cool I m upset Hunnid thousand on my head it s disrespect So offended that I had to double check You tryna check This is real life niggas think we playin chess So what s next Jump up out the bed like I m possessed I go out on tour and I say I m drinkin less End up gettin loose and gettin pictures from my ex SMS triple X That s the only time I ever shoot below the neck skrr Why you keep on shootin if you know that nigga dead Skrr That s the only kind of shit that gets you some respect Got a lot of blood and it s cold They keep tryna get me for my soul Thankful for the women that I know Ca nt go fiftyfifty with no ho ay ay Every month she do nt even love me she just puttin on a front She gon try and settle outta court and make a run Then gon ask me how I m doin I m upset Half a million on my head I ca nt accept yeah Least it makes me feel someone tried their best yeah Want to waste a half a million be my guest Made me wan na buy a vest and a TEC skrr But I m blessed I just checked Hate me never met me in the flesh Said she s got somethin s she got ta come here and collect That shit is in a box to the left to the left Got a lot of blood and it s cold They keep tryna get me for my soul for my soul Thankful for the women that I know that I know Ca nt go fiftyfifty with no ho
Drake,3TVXtAsR1Inumwj472S9r4,8 Out Of 10,0zqy3ss4CwD6u4QPksS0nI, Too rich for who Yall just got rich again Who grips the mic and likes to kill they friends I ve never been the type to make amends If shit was at a eight we like to we like to we like to Yeah if shit was at a eight we like to make it ten 1da sent this in I m goin up all the way I do nt like to talk when there s nothin else left to say Drizzy bout to drop the game is in disarray I d tell you hear me out but we both know end of the day Your sister is pressin play Your trainer is pressin play Your wifey your wifey your wifey your wifey I got ta breathe in real deep when I catch an attitude I got a whole nother level that I can tap into Max said they only bless when they attached to you The only deadbeats is whatever beats I been rappin to And the product is still the best though It s only good in my city because I said so Just to fit the estate man I had to cop a feel like presto voil tada Never a matter of could I or should I Kiss my son on the forehead then kiss your ass goodbye As luck would have it I ve settled into my role as the good guy I guess luck is on your side I guess luck is on your side All sevens no sixes rest easy get some shut eye Hold on hold on but I Miss makin em pay Helipad from Will Smith crib straight to the stage Three Forum shows but I played Staples today The neighborhood is smokey yall stay safe in this place Drizzy bout to drop the game is in disarray I d tell you hear me out but we both know end of the day Your niggas is pressin play Your nanny is pressin play Your wifey your wifey your wifey your wifey Had to go and hit reset now we here I been on top for three sets of three years I ca nt be around the niggas you minglin with I ca nt fly if I ca nt sit on the wing of that shit Try to pay it less mind They been keepin tabs on me like I m payin next time I think I sense a little fear from the other side White vans parked across the street real subtle guys Yeah never a matter of could I or should I Kiss my mom on the forehead then kiss your ass goodbye As luck would have it I ve settled into my role as the good guy I guess luck is on your side I guess luck is on your side All sevens no sixes rest easy get some shut eye Hold on hold on but I haha Hahaha I ca nt argue with you No You mad Look at you You mad You big mad hahaha I m happy Leave me alone I just want some money A lot of money I do nt get paid to argue with you No Who is you You ai nt nobody You mad
Drake,3TVXtAsR1Inumwj472S9r4,Mob Ties,7rC5Pl8rQSX4myONQHYPBK, Ay sick of these niggas sick Sick of these niggas sick sick Hire some help help get rid of these niggas skrr Sick of this shit move to the Ritz Turned out the bitch ay It is what it is yeah GLE cause that Lambo movin fast S Class G Class lotta class In a rocket and that bitch ai nt got no tags Louis bags in exchange for body bags yeah Sick of these niggas sick Sick of these niggas sick sick Hire some help help get rid of these niggas grr Fuck what it was it is what it is Whatever you did it is what it is And I m so tired tired I fuck with the mob and I got ties got the ties got the ties Knock you off to pay their tithes oh They want me gone but do nt know why It s too late for all that loveydovey shit I m your brother shit all that other shit It s too late for all that It s too late for all that ay It s too late for all that loveydovey shit I m your brother shit all that other shit It s too late for all that ay It s too late for all that Ay sick of these niggas Sick of these niggas Hire some help get rid of these niggas I m not with the rara I am a Dada My bitch in Chanel now Your bitch in Escada sick sick sick Yeah and they shook Please do nt let them fool ya I do nt care how they look nah Heard all of the talkin now it s quiet now it s shush shh Twentynine is comin they on edge when I cook cook Lead the league in scorin man but look at my assists shh Yes I be with Future but I like to reminisce yeah I do not forget a thing I m patient it s a gift yeah Try to tell em they ai nt got to do it they insist they insist Yeah I can tell I just gave em two for forty million like Chappelle two Standin over coffin with a hammer and a nail two Heard you hit up so and so that name do nt ring a bell nah Sick of these niggas sick Hire some help get rid of these niggas I m sick of this shit sick sick I m runnin a blitz Whatever you did it is what it is And I m so tired tired I fuck with the mob and I got ties lotta ties lotta ties Knock you off to pay their tithes They want me gone but do nt know why It s too late for all that loveydovey shit I m your brother shit all that other shit It s too late for all that It s too late for all that ay It s too late for all that loveydovey shit I m your brother shit all that other shit It s too late for all that ay It s too late for all that
Drake,3TVXtAsR1Inumwj472S9r4,Cant Take A Joke,1dUHF4RyMmMTveJ0Rby6Xm, Ayo blast that shit Maxx Blast that shit back if you blastin UberX to Hidden Hills Give me somethin I can feel If they come to Hidden Hills Then I know they know the deal We just right there up the road You could hit it wit a stone I be out here on my own I m just tryna set the tone I ve been kicked when I was down None of that shit matter now Niggas think they run the town Till we run em out of town And they got ta relocate Got ta dip from where they stay Everything will be okay Man just stay up out my way Skit around ends with the bros and I m kitted to the toes If I touch studio then we got one I be tryna laugh with the bros bout the opps that we know But they ca nt take a joke cause it s not one Think it s cause we live by the code reputation to uphold Makin me the one they got ta take the spot from I be tryna laugh with the bros but they ca nt take a joke Ayo blast that shit Maxx Blast that shit back if you blastin Yeah yeah Back and forth to Italy My comment section killin me I swear I get so passionate Yall do not know the half of it I grew up with the Reps Up boys be crashin it and splashin in And when I say they crashin it I do not mean a accident Im I m still in the studio at 645 And my haters either on they way to work or they arrived And I got ta own the things I rap about just for my pride You know when it comes to pride I ca nt put that shit aside I ve been kicked when I was down None of that shit matter now They be throwin in the towel I do yellowtail at TAO They be watchin what they say Especially when it s to my face Everything will be okay Man just stay up out my way Skit around ends with the bros and I m kitted to the toes If I touch studio then we got one I be tryna laugh with the bros bout the opps that we know But they ca nt take a joke cause it s not one Think it s cause we live by the code reputation to uphold Makin me the one they got ta take the spot from I be tryna laugh with the bros but they ca nt take a joke
Drake,3TVXtAsR1Inumwj472S9r4,Talk Up (feat. Jay-Z),4ksuI04WMvUnJbHQjgs3L5, Lot of 6 s in here tonight Yeah yeah ay Ten of us we movin as one I m so proud of who I ve become You might think I ve taken some lumps Only if we talkin bout sums yeah Intentions are pure they can not tell me relax My mentions are jokes but they never give me the facts This s and that s ca nt be ignorin the stats Based off of that they got ta run me the Max They got ta run me the Max they got ta double the racks They had it set up for real but they did nt come with the slaps When I heard the shit I was skippin through that If I get it trippin it s no comin back I do nt understand these niggas got ta adapt You know where I m at I put the 6 on the map Your shorty was bent she wanted to vent I promise it fell in my lap My money is young my problems are old I promise I m bridgin the gap You know what I m sayin woo Ay ay yeah You know what I m sayin gyeah gyeah gyeah gyeah Niggas provoke this shit ai nt a joke man nobody playin He s at the top and he s at the top but nobody stayin These niggas around but they ai nt around You know what I m sayin Say that they down when they shit is down You know what I m sayin Yeah you know what I m sayin Ay ay yeah You know what I m sayin Yo get close enough to HOV smell like a kilo still First album 26 I ai nt need no deal Already a hood legend I ai nt need no shine First Rollie flooded out I ai nt see no time whoa Standup niggas we only duckin indictments Dope boys offwhite lookin like soft white on em heh You know what I m sayin We in the buildin we came for a billion ai nt nobody playin Live every word that I m rappin Said I lost 90 bricks and it happened You probably would nt believe everything that you seein right now if it was nt live action I ai nt on the Gram they record who I am God to these dope boys how you not be a HOV fan I m what Meech shoulda been I m what Supreme did nt become If Alpo did nt snitch niggas ll be like Young I got your president tweetin I wo nt even meet with him Yall killed X let Zimmerman live streets is done You know what I m sayin Ay ay yeah You know what I m sayin
Drake,3TVXtAsR1Inumwj472S9r4,Is There More,1Tnw0ItH1Macok8gblnPPd, Only holdin up I do is my end of the bargain Only beggin that I do is me beggin your pardon Only tryin that I do is me tryin the hardest Only problems I do are math problems with profit Only lyin I do is lyin out in the tropics Only cryin I do is cryin from laughin bout it Only lackin I can do is my lack of responses Only rest that I do is Where the rest of my commas Still I rise Maya Angelou vibes When life comin at you from all angles and sides And they do nt wan na see that you smilin from inside It really boils down to how you plan to survive Love certain ones but never get attached to em Give em nice things but what s that to em Especially when another girl I flew in is flickin up in my bathroom And they recognize the bathroom All hell starts to break loose in my texts I only tell lies to who I got ta protect I would rather have you remember me how we met I would rather lose my leg than lose their respect But that ll never happen the way I m watchin my step That ai nt what I m bout I m in control of my destiny never in doubt If I ca nt make it with you I ll make it without They say take the good with the bad I ll take it without Houston women I wineanddine and take to the house My moral compass is janky it breaks in the south Is there more to life than digits and bankin accounts Is there more to life than sayin I figured it out Is there more Yeah Sweeter the berry the blacker the juice The boy is back in the booth ready to tap into truth Too many lyrics bout houses and loot Too many Walt Disney characters mouses and goofs I mean you know I love a challenge but challenged by who I ll let you bring a thousand recruits My peers are a talented group But even if you take all their statistics and carry the two Even if you rounded up the numbers and rounded the troops There s still nothin they could really do It s too bad reality checks do nt cover the balances due Whenever it s time to recoup Yeah soon as this album drop I m out of the deal In the house playin DAngelo How Does It Feel I got a fear of havin things on my mind when I die What you got time on your hands or time on your side Is there any sense in doin these songs when I m high Is there more to life than goin on trips to Dubai Yachts on 4th of July G5 soarin the skies Is there more to life than all of these corporate ties And all of these fortunate times And all of these asses that never come in proportionate size Am I missin somethin that s more important to find Like healin my soul like family time Is there more to life than just when I m feelin alive Is there more Passion instant Sweat beads feel me feel me Cupid s shot me My heartbeat s racing my heartbeat s racing Tempt me drive me tempt me Feels so exciting Thought of highly highly It s yours entirely I ll be I ll be more than a lover More than a woman More than your lover for you
