Artist,Artist_id,Song,Song_id
Quavo,0VRj0yCOv2FXJNP47XQnx5,PASS OUT (feat. 21 Savage),3edzl4zvKFi0D3iuF6cs2f
Quavo,0VRj0yCOv2FXJNP47XQnx5,FLIP THE SWITCH (feat. Drake),1rlIrbWboTRGeKfHhgbJRZ
Quavo,0VRj0yCOv2FXJNP47XQnx5,CHAMPAGNE ROS (feat. Madonna & Cardi B),2i4WKnGYntsN4jEvDjkKBE
Quavo,0VRj0yCOv2FXJNP47XQnx5,KEEP THAT SHIT (feat. Takeoff),2QApWGconWQE8BjaNfh7ik
Quavo,0VRj0yCOv2FXJNP47XQnx5,LOSE IT (feat. Lil Baby),69PkhA9q3xCWU2CzoZnLAu
Quavo,0VRj0yCOv2FXJNP47XQnx5,RERUN (feat. Travis Scott),0JYAsQJWIuaYUvZGF1qapT
Quavo,0VRj0yCOv2FXJNP47XQnx5,LOST (feat. Kid Cudi),2H5CLUmtvo2VHEeWzMtUqW
