Artist,Artist_id,Song,Song_id
Jay Rock,28ExwzUQsvgJooOI0X1mr3,"King's Dead (with Kendrick Lamar, Future & James Blake)",51rXHuKN8Loc4sUlKPODgH
Jay Rock,28ExwzUQsvgJooOI0X1mr3,Wow Freestyle (feat. Kendrick Lamar),4lboLlUWSw20PU2qcYgUny
Jay Rock,28ExwzUQsvgJooOI0X1mr3,WIN,6zaywrggIpaM7Ghgvgjb8R
Jay Rock,28ExwzUQsvgJooOI0X1mr3,Tap Out (feat. Jeremih),0U6DEXxx5D727xgg76jYkR
Jay Rock,28ExwzUQsvgJooOI0X1mr3,Shit Real (feat. Tee Grizzley),2v54cdlUANmBDwrHJ1MebE
Jay Rock,28ExwzUQsvgJooOI0X1mr3,OSOM (feat. J. Cole),7w2R9UtQzGu891Vuqh7w7Y
Jay Rock,28ExwzUQsvgJooOI0X1mr3,Hood Gone Love It (feat. Kendrick Lamar),6i6cWTCYBOKEdJnWjzm2yk
Jay Rock,28ExwzUQsvgJooOI0X1mr3,Vice City (feat. Black Hippy),2SIdGJTWirTxRNEyCp9ocI
Jay Rock,28ExwzUQsvgJooOI0X1mr3,The Bloodiest,72EgPk2yUz4t5eB1CR1r5I
Jay Rock,28ExwzUQsvgJooOI0X1mr3,Redemption (feat. SZA),78qobbITMyWpuumc6jTcKC
